"Name","Phone","Address"

"Kangaroo Studies Pvt Ltd","+ 91  183 5017591","Scf-50, Second Floor, Amritsar - 143001, Kabir Park, Opposite Guru Nanak Dev University"
"Bright Gateways Beas IELTS Centre","+ 91  9815376752","First Floor, Street No 3, Main Market, Main Bazar,, Amritsar - 143001"
"Sultan Consultancy Services","+ 91  183 5012993","55, Basement, Amritsar - 143001, Kabir Park Market, Opp Gndu"
"Jaryal Consultants","","109, 2nd Floor, City Centre, Amritsar - 143001, Opposite Gurunanak Bhawan"
"Bal Gill Consultants","+ 91  183 2534711","Shop No: 63, City Centre, Amritsar - 143001"
"Makkar Consultancy","+ 91  9988401021","B-308, Ranjit Avenue, Amritsar - 143001, Guru Arjan DEV Park"
