"Name","Phone","Address"

"Lemon Leaf Event & Proms","+ 91  9877009700","Near Sugar Mill Gate,G.t.road,P.o. Rayon & Silk Mill,Chheharta, Amritsar - 143001"
"Lemon Leaf Events & Promos","+ 91  183 5056773","10-P, Khanna Complex, 1st Floor,M.m.malviya Road, Amritsar, Sco 92-93, Sector 17 C, Opp. Subway, Chandigarh, Amritsar - 143006, E 509, Brs Nagar, Ludhiana"
"Randhawa Entertainment","+ 91  9814278450",""
"Rajasthani Folk Show Organi...","+ 91  9636517228","325, Rai Colony,, Civil Lines, Jaipur - 302006, Near Tejaji Temple,"
"Search4celebs.com","+ 91  8888096666","Goregaon East, Mumbai - 400063"
"The Sky Waves Event Management","+ 91  9893039120","502, Lucky Plaza, New Market, Bhopal - 462003, Opposite Apex Bank"
"Oyeluckyluckyoye Entertainm...","+ 91  9595548264","Hno. 122/G22, Nagpur - 440017, Near vithoba manjan company"
"Lord Productions","+ 91  11 33089757","15, Ashok Lane, Mandir Marg, Delhi - 110001, cannaught Place"
"Rankawat Events & Caterers","+ 91  9983281444","Ratanada, Jodhpur - 342011, Near Old Campus"
"Shubharambh Events","+ 91  7798767936","City Centre Complex, Shop No 112, Lane No 2, Amravati - 444601, Near Anant Super Bazar, Panchwati Square, Radha Nagar"
"X Pressif Events","+ 91  9256676777","996/1, Shan Gali,, Amritsar - 143002, Chowk Laxmansar,"
"Shaan Entertainers","+ 91  9878406837","Scf-45, Amritsar - 143002, Kabir Park Market, Opposite- Gndu"
"Punjab Entertainer Wedding & E...","+ 91  9814873707","45-A, Ranjit Avenue,, Ranjit Avenue, Amritsar - 143001"
