"Name","Phone","Address"

"Mahindra & Mahindra Ltd","+ 91  522 2238939","Saran Chamber, 5-Park Rd, Hazratganj, Lucknow - 226001"
"Speed Motors","","3, Shahnajaf Road, Hazratganj, Lucknow - 226001"
"Tanya Automobiles Pvt Ltd","+ 91  522 4105000","2 - A, Shahnazaf Road, Hazratganj, Lucknow - 226001, Near Shahnazaf Imambara, Opposite Saharaganj"
"Force Motor","+ 91  522 2325873","B-1/21, Aliganj, Lucknow , Sec-A"
"Trilok TVS","+ 91  522 3097885","Hazratganj, Lucknow - 226001"
"Star Yamaha","+ 91  522 3915077","10, Lalbagh, Hazratganj, Lucknow - 226001, Opposite Naza Market, Near Old Basant Cinema Building"
"Hindustan Motors Ltd","+ 91  522 2283130","B-6,2nd,SAS House, Sapru Mg, Hazratganj, Lucknow - 226001"
"Mehrab Auto Movers Pvt Ltd","+ 91  522 2209852","508,Colossal Apt, 6,Way Ln, Lucknow - 226001"
"Mahindra & Mahindra Ltd","+ 91  522 2310597","Mahindra Towers, 3rd Floor, Faizabad Road, Lucknow - 226002, Near Hal"
"A Auto Motors Pvt Ltd","+ 91  522 2815576","Faizabad Rd, Chinhat, Lucknow - 226028, Opp Akashvani"
"Bajaj Automobiles","+ 91  522 2221728","B N Rd, Lucknow - 226001, Opp Nishat Cinema"
"Auto Movers TVS Faizabad Rd","+ 91  9415008289","Faizabad Rd, Lucknow - 226001"
"Jugal Kishore Motors","+ 91  522 2207770","13, YMCA Bldg, Rana Pratap Marg, Lucknow - 226001, opposite dainik jagran"
"Jemini Continental Pvt Ltd","+ 91  522 2200682","10, Rani Laxmi Bai Mg, Hazratganj, Lucknow - 226001"
"Prabhu dayal auto","+ 91  9936060406","Shop no.5, Ashok marg, Hazratganj, Lucknow - 226001, Opp tvs showroom"
"Sindh Automobiles","+ 91  522 2627980","Shop Number- 2, Lalbagh, Lucknow - 226001, Near Novelty Cinema Chouraha"
"SAI Automobile","+ 91  522 2340315","1395/4, D-block ring road, Indira Nagar, Lucknow - 226016, SARASWATI inter college"
"Auto Movers","+ 91  522 2342375","Indira Nagar, Lucknow - 226016, Blk-C,Nr Haify Rd"
"BEE Kay Motors","+ 91  522 2438115","B-8, Nadarganj, Lucknow - 226008, Industrial Area, Amousi"
"KSB Radlas Pvt Ltd","+ 91  522 4045255","16,Bhopal House,, Ganj Raod, Lalbagh, Lucknow - 226001, near nagar nigam office"
"Unique Car Sales","+ 91  9335911226","Ufg,B-3,Shah Trade Centre, Valmiki Mg, Lalbagh, Lucknow - 226001"
"Lucknow Raman Motors","+ 91  9335018960","D-1, Transport Nagar, Transport Nagar, Lucknow - 226012"
"Lucky Automobile","+ 91  9793513539","Hans Khera, Lucknow - 226017, Para Thana"
"Narayan Auto Mobiles","+ 91  522 2757547","Seetapur Road, Daliganj, Lucknow - 226007, Triveningar"
"Bk Distributors","+ 91  9935066100","B 8, Nadar Ganj Indl Area, Amousi, Amousi Airport, Lucknow - 226009"
"Motorsales Limited","+ 91  9839272828","Charbagh Railway Station, Charbagh, Charbagh Railway Station, Lucknow - 226004, Near Ravindralaya"
"Auto Line","+ 91  522 2327673","Lucknow - 226001, Baranchand Ganj"
"Kalyan Motors","+ 91  522 4049545","293, Faizabad Road, Gomti Nagar, Lucknow - 226010, Government Polytechnic Crossing, Vibhuti Khand"
"Honda Siel Power Products Ltd","+ 91  522 2323424","B-2-, J-Rd, Mahanagar, Lucknow - 226006"
"Naaz Service Centre","+ 91  9415067001","A P Sen Road, Lucknow - 226001"
"Auto king","+ 91  9335812519","Shop No.4, Opposite Dayanidhan Parkind, Lalbagh, LUCKNOW - 226001, Lalbagh"
"Ts Motors Pvt Ltd","+ 91  9335019666","Shahnajaf Road, Hazratganj, Lucknow - 226001"
"Gemini Continental","+ 91  522 2612172","10, Rani Laxmi Bai Mg, Lucknow - 226001"
"M S Auto Mobiles","+ 91  522 2221507","Shop No-6, Kaisarbagh, Lucknow - 226001, Opp Hathi Park,Jawahar Ngr Clny"
"Reliable Automobiles","+ 91  522 2270050","Shop No-3, Kaisarbagh, Lucknow - 226001, Opp Liberty Cinema"
"Bajaj Genuine& Parts","+ 91  9839768512","Patkarpuram Road, Gomti Nagar, Lucknow - 226001, Petrol Pump"
"Lucknow Auto Sales","+ 91  522 2360313","46/34, Lalbagh, T.n. Road, Lucknow - 226001"
"A.K Motors","+ 91  522 3222524","Purain Tiraha Railway Crossing, Sitapur Road, Lucknow - 226001"
"M B ENT","+ 91  522 2352415","Yadav Cplx, Faizabad Rd, Misra, Lucknow - 226016, Murari Ngr"
"Narula automobils","+ 91  8808119395","Shop No-551/29, Sardari Khera, Kanpur road, Alambagh, Lucknow - 226005, Near Alambagh Bus Stand"
"Reliance Motors","+ 91  9415312621","6-C/1,Reliance Tower,Faizabad Road, Faizabad Road, Lucknow - 226002"
"Bajaj Auto Ltd","","P No-18, Mahanagar, Lucknow - 226006, Mahanagar Extn,J Park"
"Shukla Automobile","+ 91  9807892626","Faizabad Road Chinhat, Chinhat, Lucknow - 226028, Matyari Chauraha"
"Prakash Automobile","+ 91  522 2226158","18,Bhopal House, Lalbagh, Lucknow - 226001"
"Sagar Automotives","+ 91  522 2274950","Ag-2,Bg-1,B N Plaza,7, B N Rd, Kaisarbagh, Lucknow - 226001"
"Mvv Motors","+ 91  9838599989","Badi Jugauli, Gomti Nagar, LUCKNOW - 226010, Gomti Nagar"
"Aman Car Sales","+ 91  522 2228555","183, Lalbagh, Lucknow - 226001, Daya Nidhan Park"
"Kailash Motors","+ 91  522 2238443","F-7,1st Flr,Saran Chambers-5, Park Rd, 5 Park Road, Lucknow - 226001"
"Delhi Car Accessories","+ 91  9795577552","35, Lucknow - 226001"
"Ekta Motores","","Plot No A/1/5/ D Priyadarshini Yojna, Lucknow - 226001, Near Kiran Gas Service"
"Future Automobiles","+ 91  522 6561128","Future Auto Compound, Lucknow - 226001, Sitapur Road Nh-24,Neear IIM Crossing"
"K D J B Tyres","+ 91  522 2200124","Nr Bithanli Crossing, Lucknow - 226001"
"Garga Marketing","+ 91  9415105616","Ali Ganj, Lucknow - 226001"
"New Anything","+ 91  9415516588","Arohi Plaza Patrakarpuram, Lucknow - 226001"
"China Bazaar","+ 91  522 3215978","3/111, Lucknow - 226001, Vivek Khand, Near Nilkanth Sweet"
"Anand Motor Agencies Ltd","+ 91  9415013063","A P Sen Road, Lucknow - 226001"
"Bharat Auto Electric Parts","+ 91  522 2201646","Silamia College, B. N Road, Lalbagh, Lucknow - 226001"
"S.A.Automobiles Part dealers","+ 91  9695700800","shop no. 1-8, main road, Burlington Chauraha, Lucknow - 226018, opposite petro pump"
"Coolex Auto Sales","+ 91  9415409341","28, Vidhan Shabha Marg, Husainganj, Hussainganj, Lucknow - 226001, Lucknow"
"Mishra & Sons","+ 91  9335356227","Raibareli Road, Canal Colony, Lucknow - 226001"
"Goodwill Automobiles","+ 91  522 2223951","Basement,Citi Hotel Cplx,24, B N Rd, Lalbagh, Lucknow - 226001"
"Classic Cars","+ 91  9369657452","Mausam Bag, Sitapur Road, Lucknow - 226002, Sitapur Road"
"Pravin Automobile","+ 91  9415026165","Burlington, Burlington, Burlington Hotel, Lucknow - 226001"
"Haind Tractors","+ 91  522 2625247","46/33, Lalbagh, Lucknow - 226001"
"National Car Sales","+ 91  522 2230308","37, Super Market, Lalbagh, Lucknow - 226001"
"Sapna Motors","+ 91  522 2624111","Lalbagh, Lucknow - 226001, Opp Bhopal House"
"Shalimar Car Sales","+ 91  522 2270409","Halwaliya Building, Lalbagh, Lucknow - 226001, Opp Bhopal House"
"Universal Car Sales","+ 91  9450357804","Mahabeer Plaza, Lalbagh, B N Road, Lucknow - 226001"
"Goldrush Sales And Services Ltd.","+ 91  7860024399","6a, Sapru Marg, Lucknow - 226001"
"Sunwind Devices Private Limited","+ 91  522 2301031","3/411, Vishal Khand, Gomti Nagar, A P Sabha, Lucknow - 226001"
"Prabha Autogas Engineering","+ 91  9044477788","B-86, Vibhuti Khand, Lucknow - 226001, Gomti Nagar"
"Rajdhani Tyres","+ 91  522 4002889","B, 104,, Sahara, Lucknow - 226001, Trade Centre"
"Chitransh Motors","+ 91  9415086237","C 3,, Sector J A P, Lucknow - 226001, Sen Road"
"Motor Sales Limited","+ 91  9415013577","Charbagh A P Sen Road, Lucknow - 226001"
"Gud S Car Care","+ 91  522 2383366","Main Road A P Sen Road, Lucknow - 226001"
"T S Motors Workshop","+ 91  522 2325248","Chhanni LAL, Chauraha A P, Lucknow - 226001, Sen Road"
"Vintage Car Bazar","+ 91  9839136814","B15 1st Flr, Sector F, Lucknow - 226001, Ahibarapur"
"Auto Care Centre","+ 91  9415001456","Vijay Khand Near Main Road, Lucknow - 226001"
"Tanisha Auto Sales I Pvt Ltd","+ 91  522 6529392","439/6k,, Peer Bukhara, Lucknow - 226001, Hardoi Road"
"Autochek","+ 91  522 3019360","103, 1st Flr,, Lucknow - 226001, RIZ Building"
"Pioneer Service Station","+ 91  9838814040","21, Vidhan, Lucknow - 226001, Sabha Marg"
"Prateek Industries","+ 91  522 6523826","B 20, Cooters Ancillary Estate, Lucknow - 226001, A P Sen Road"
"Kamal Agencies","+ 91  522 2362459","A P Sen Road, Lucknow - 226001"
"Asn Traders","+ 91  9335917754","Dr B N Varma Rd, Lucknow - 226001"
"Shree Mega Mart","+ 91  9415104473","Super Mall Mama Chauraha, Lucknow - 226001"
"Car Decor","+ 91  522 2623612","1, Old Bhopal House, Lucknow - 226001, A P Sen Road"
"Balaji Auto Centre","+ 91  522 2471276","Kanpur Road, Nr IBP Petrol Pump, Lucknow - 226001, A P Sen Road"
"Premier Auto Cables","+ 91  9935056736","E 32 Amausi, Lucknow - 226001"
"Bearings And Machinery Co","+ 91  522 3014613","15,, Bhagat Singh Market, Lucknow - 226001, Latouche Road"
"Car Accessories World","+ 91  522 3053208","G-224, Indira Nagar,, Sahara Trade Centre, Lucknow - 226001, Faizabad Road"
"Yash Car Accessories","+ 91  522 2218987","31/16,, Gf Shah Trade, Lucknow - 226001, Centre Valmiki Marg"
"Universal Car Sales","+ 91  9839072993","Ug 1, Mahabeer Plaza, B N Road, Lalbagh, Hussainganj, Lucknow - 226001"
"Sindhi Automobiles","+ 91  522 2227980","Kaisarbagh, Lucknow - 226001"
"Amit Traders","+ 91  9305032827","8, Lalbagh, Lucknow - 226001, Opposite Dyanidhan Park"
"Haneef Auto Electronic","+ 91  9838898272","Station road, Charbagh, Lucknow - 226004, Opp. To petrol pump"
"Aggarwal Motors","+ 91  522 2225936","24,Bhopal House, Lalbagh, Lucknow - 226001"
"Alliance Automobiles Pvt Ltd K...","+ 91  522 2229049","23,Bhopal House, Kaisarbagh, Lucknow - 226001, Lalbagh"
"Rajendra Automobiles","+ 91  522 2274959","15,Bhopal House, Lalbagh, Lucknow - 226001"
"Mama Car Sales","+ 91  522 2617514","8,Bhopal House, Lalbagh, Lucknow - 226001"
"Saket Car Sales","+ 91  522 6546720","15 Bhopal House, Lalbagh, Lucknow - 226001"
"Winkle Auto Agency","+ 91  9335042000","21 Shah Trade Centre, Valmiki Marg, Lalbagh, Lucknow - 226001, Lalbagh"
"Amit Lubrication","+ 91  9415012247","22, Bhopal House, LAL Bagh, Lucknow - 226001"
"Cml Holdings Ltd","+ 91  9839025218","7/9, Shahnajaf Road, Lucknow - 226001"
"Commercial Motor Ltd","+ 91  522 2624237","11, Mahatma Gandhi Mg, Kaisarbagh, Lucknow - 226001"
"Anjali Motors","+ 91  9415325231","Park Lane,, Behind New Hanumand, Lucknow - 226001, Mandir Mahanagar"
"Bakshi auto career","+ 91  522 3918521","G2 jai hind complex, Lalbagh, Kaisarbagh, Lucknow - 226001, Opp vijya bank"
"Supremo Auto Mobile","+ 91  522 3297031","Lalbagh, Lucknow - 226001, Near Novelty Cinema"
"Jaiswal Auto Accessories","+ 91  9997470108","Shop No B/1, Basement 1, Shah Trade Center Valmiki Road, Lucknow - 226001, Near Novelty Cinema"
"Sri Shiva Automobiles","+ 91  9421518574","Main Road, Narahi, Lucknow - 226001"
"V K Automobiles","+ 91  9044738908","12, G G S Marg, Hussainganj, Lucknow - 226001, Near Medical Store"
"Winkle Auto Agency","+ 91  522 2392346","Lucknow - 226001, Hah Trade Centre Lalbagh"
"Car World","+ 91  9335913768","Shah Trade Centre,1st Flr, Valmiki Mg, Lalbagh, Lucknow - 226001"
"Car Beauty Point Sachin Auto A...","+ 91  522 2618981","A-2,32/16 Lgf,Hall Shah Business Centre, Balmiki Marg, Lucknow - 226001, Hazratganj"
"Bindra Auto Stores","+ 91  522 2625010","61-A1, Ggs Mg, Lucknow - 226001"
"Murthy Car","+ 91  9335231668","Trade Point Ground Floor Saran Chamber-1 Park Road, Hazratganz Lucknow, Hazratganj, Lucknow - 226001"
"Mohan Motors","+ 91  522 2218844","32/4, Valmiki Mg, Hazratganj, Lucknow - 226001, Nr I G Jail"
"Mahajans Automobiles","+ 91  522 3018035","Shop No GN-16 ABC Complex,, Quinton Road, Kaisarbagh, LUCKNOW - 226001, Opposite Shubham Cinema"
"Lakhimpur Finvest Co Ltd","+ 91  522 2613046","3, 1st Floor, Natraj Complex, 11 B N Road, Lalbagh, Lucknow - 226001, near noor manzil pagalkhana ka hospital"
"Shimla Motors","+ 91  9305742167","No 25/26, Lalbagh, Lalbagh, LUCKNOW - 226001"
"Reliable Agency","+ 91  9935441115","ABC Complex, B N Road, Kaisarbagh, Lucknow - 226001, Near Shubham Cinema"
"Behal Automobiles","+ 91  9450500294","Bm-1, ABC Market, Gokhale Marg, LUCKNOW - 226001, Quinton Road"
"Jaiswal Auto Agency","+ 91  9918383489","lalkuan, Guru Govind Singh Marg, Lalkuwan, Lucknow - 226001, near thakur transport"
"Sonu Auto Agency","+ 91  522 3098051","2, Cantt Rd, A P Sabha, Lucknow - 226001, Nr Shubham Cinema"
"S K Auto Ceter","+ 91  9450355022","G N 10, ABC Complex Near, Lucknow - 226001, Shubham Cinema"
"Bakshi Enterprises","+ 91  9918299407","lalbagh, Kaisarbagh, Lucknow - 226001, opp. Subham Cinema"
"Sunny Car Sales","+ 91  522 2227860","Lalbagh, Lucknow - 226001, Opp Darulshafa"
"JAI Surya Automobiles","+ 91  522 2283488","82/46,Pooja Cplx, Guru Govind Singh Mg, Lucknow - 226001, Lalkuan"
"Bajaj Auto Spares","+ 91  522 2621728","5, B N Road, Lucknow - 226001"
"S.S Credit And Financial Services","+ 91  522 2209441","Old YMCA Building 13, Rana Pratap Marg, Lucknow - 226001"
"Modern Automobiles Service Sta...","+ 91  522 2224218","16, Vidhan Sabha Mg, Kaisarbagh, Lucknow - 226001"
"A S Motors","+ 91  522 2451138","280/116,Sunita Sadan,38, Lucknow - 226001, B S Blunt Sqaure"
"Ashirwad Automotive","+ 91  522 2756566","Station Rd, Lucknow - 226001, Nr Devki Nurshing Home"
"Ashok Motor Stores","+ 91  522 2227311","22600, Kaisarbagh, Lucknow - 226001"
"B K Distributors","","62, Guru Govind Singh Mg, Lucknow - 226001, Lalkaun"
"Gattani Automobile","+ 91  522 2816825","Lucknow - 226001, Arjun Ganj"
"Gattani Automobiles","+ 91  522 2691289","82, Lucknow - 226001, Rajendra Ngr"
"Gold Wheels Automotives","+ 91  522 2238867","91, Mahatma Gandhi Marg, Lucknow - 226001"
"Kinetic Mktg & Services Ltd","+ 91  522 2451733","VIP Rd, Lucknow - 226001, Nr Pakri Ka Pul"
"Magna Automations Pvt Ltd","+ 91  522 2274461","No-3, Kaisarbagh, Lucknow - 226001"
"Mala Sadh Asian Automobiles","+ 91  522 2215373","Kaisarbagh, Lucknow - 226001"
"Mangala Motors Pvt Ltd","+ 91  522 2270178","43, Vidhan Sabha Mg, Kaisarbagh, Lucknow - 226001, Hussain Ganj"
"Manjusha Auto Service & Spares","+ 91  522 2222954","4,1st Flr, Park Rd, Kaisarbagh, Lucknow - 226001"
"National Automobiles","+ 91  522 2224924","Kaisarbagh, Lucknow - 226001"
"Pioneer Automobiles","+ 91  522 2228192","10, Forsyth Rd, Kaisarbagh, Lucknow - 226001"
"Sunny Motors Pvt Ltd","+ 91  522 2201190","1, Sapru Mg, A P Sabha, Lucknow - 226001"
"Sahni Dynamic Wheels","+ 91  522 2616920","5,Avadh Cplx, Cantt Rd, A P Sabha, Lucknow - 226001, Nr Subham Cinema"
"Alliance Automobiles Pvt Ltd","+ 91  522 2222072","6, Park Rd, Kaisarbagh, Lucknow - 226001, Ped Guest House"
"Aman Motors","+ 91  522 2614602","42, Balmiki Marg, Lucknow - 226001"
"Behari ENT","+ 91  522 2623989","21, V S Mg, Lucknow - 226001"
"Harihar Automobiles Pvt Ltd","+ 91  522 2621030","28-A, V S Mg, Lucknow - 226001"
"Devendra Motors Pvt Ltd","+ 91  522 2613495","Grd Flr,Sahkarita Bhawan, V S Mg, Lucknow - 226001"
"Rdv ENT Pvt Ltd","+ 91  522 2322143","Faizabad Rd, Lucknow - 226001, LML World"
"Duggal Motors","","21, Station Rd, Lucknow - 226001"
"Swaraj Automobiles","+ 91  522 2437169","Kabpur Rd, Lucknow - 226001, Gauri Bzr"
"Provin Automobiles","+ 91  9989979107","Barlington Road Hazratganj, Hazratganj, Lucknow - 226001"
"Modern Automobile","+ 91  522 2624218","16,Vidhan Sabha Mrg, Vidhan Sabha Marg, Vidhan Sabha Marg, Lucknow - 226001"
"Car Exchange","+ 91  522 3012340","Shop G-4 Sahara Trade Centre, Nagar Nigam Market, Hazratganj, Lucknow - 226001, Opp Darulshaffa"
"Lucknow Car Bazar","+ 91  522 2617276","T.n. Road, Lucknow - 226001, Near Janpath Opp Darulshafa"
"Mohan Car Sales","+ 91  522 2757951","Puraniya, Sita Pur Road, Lucknow - 226001"
"Romi Motors PVT LTD","+ 91  522 2217985","12, Cantt Road, Lucknow - 226001, Opp Swaroop Palace"
"Efche Motors LTD","+ 91  522 2648046","44 A Laxmi Plaza, Hussianganj, Cantt Road, Lucknow - 226001"
"Sandeep Automobiles","+ 91  522 2453459","Talkatora Road, Lucknow - 226001"
"Jain Auto Spares","+ 91  9839060141","42-E (Opp Jail Office), Balmiki Marg, Hazratganj, Lucknow - 226001, Opp Jail Office"
"Meerut Sports","+ 91  9415513383","53, Mumtaz Mkt Aminabad, Aminabad, Lucknow - 226018"
"Amber Hardware & Tools Company","+ 91  522 2626829","23/B Gautam Bhudh Marg Latouche Road, Aminabad, Lucknow - 226018"
"LUCKY AUTOMOBILES","+ 91  9839029390","19, R K ROAD, Kaisarbagh, Lucknow - 226001, OPP. POLICE STATION"
"Standard Auto Works","+ 91  522 2637825","98-2, Gautam Budh Marg, Lucknow - 226001, Near railway station"
"MARS EQUIPMENT LTD.","+ 91  522 3013800","Shop no. 28 A, b.n road, Burlington Chauraha, Lucknow - 226018, opp. Jwala hotel"
"Khalsa Kumar Automobiles","+ 91  9935065189","Main Road, Aliganj, Lucknow - 226018, Sector J, Near Manohar Hotel"
"Pindi Motors","+ 91  9415106970","shop no.6,, Tripathi Building,Charbagh, Charbagh, Lucknow - 226004, Char Bagh"
"Sigma Automobiles","","Ugf-202 Sahara Trade Center, Faizabad Road, Faizabad Road, Lucknow - 226002"
"Abhishek Travel","+ 91  522 2391802","21 Basement Sumeet Complex, Vibhuti Khand, Gomti Nagar, Lucknow - 226002"
"Creative Sale Purchase Centre","+ 91  9839131997","Murai Yadav Complex, Faizabad Road, Lucknow - 226002"
"JAI MAA Car Sales","+ 91  522 2334775","S-1/5 Kailash Kunj, Faizabad Road, Lucknow - 226002"
"Kinetice Palace","+ 91  522 2346884","Harshita Complex, Faizabad Road, Lucknow - 226002, Near Kukrail Pul"
"Heena Car Decor","+ 91  9335092278","Faizabad Road, Faizabad Road, Lucknow - 226002"
"Neemkand Autospair","+ 91  9335514028","Seetapur Road, Khadra, Lucknow - 226002, Tarun Market"
"Shanu Shocker","+ 91  9336966419","Raeen Nagar, Campbell Lines, Lucknow - 226002, Near LAL Masjid"
"Shagun Automobile","+ 91  9935264581","No 62, Guru Govind Marg, Lalkuwan, LUCKNOW - 226001, Lalkuan"
"Impact Motors","+ 91  9336835437","Alamnagar Crossing,Csinhat, Gokhale Marg, LUCKNOW - 226001, Faizabad Road"
"Bright Automobiles","+ 91  522 2681065","B-78, Latoch Rd, Aminabad, Lucknow - 226018"
"Rider Auto Agency","+ 91  9935655599","Quinten Road, Qaiserbagh, Lucknow - 226001"
"Car Clinic","+ 91  9335257774","Jagathnarayan Road, Ganesh Ganj, LUCKNOW - 226018, City Station"
"Sethi Automobiles","+ 91  522 3245126","Shop No 6, Hamid Road, Wazir Ganj, Lucknow - 226018, Near City Station"
"Car Alnkar","+ 91  9415018459","G-213 Shahara Trade Centre, Lucknow - 226004"
"Indica Motors","+ 91  9453176026","Vikash Nagar Ring Road, Lucknow - 226004"
"Royal Motors","+ 91  522 2254234","Chowk, Lucknow - 226003"
"Vijaya Car Sales","+ 91  9335236973","K-5/95,Kailash Kunj, Faizabad Rd, Faizabad, Lucknow - 226007"
"Rvd ENT Pvt Ltd","+ 91  522 2342345","LML World,Yadav Cplx, Faizabad Rd, Misra, Lucknow - 226016, Nr Kukrial Bridge"
"Gupta Automobiles","+ 91  9450365007","17, New Goal Market, Mahanagar, Lucknow - 226006, Near Vikas Nagar Tempo Stand"
"Vasu Oils","+ 91  522 2781744","ram jas building, Nishatganj, Nishatganj, Lucknow - 226006, Opposite Prem Bazar"
"Kedar Nath Ram Nath & Company","+ 91  9839843268","249/39 Raja Bazar Park -2, Raja Bazar, Lucknow - 226003"
"Abhilasha Motors","+ 91  522 2343646","Yadav Cplx, Faizabad Road, Lucknow - 226010, Nr Kukrail Bridge"
"Bajaj Auto Ltd","","B-36, J Rd, Mahanagar, Lucknow - 226006, Mahanagar Extn"
"Beeaar Hundai","+ 91  9450026553","B943, Sector A, Mahanagar, Mahanagar, Lucknow - 226006"
"Vibgyour Vehicles","+ 91  522 4069548","Lekharaj Market 1, Faizabad Road, Faizabad Road, Lucknow - 226010"
"Gyan Auto Sales","+ 91  9838009939","No 5/60, Vijay Khand, Gomti Nagar, LUCKNOW - 226010, Gomti Nagar"
"A.K Auto Spares Parts","+ 91  9839453602","3/18 Vijay Khand, Gomti Nagar, Gomti Nagar, Lucknow - 226002"
"Shivi Auto Mobiles","+ 91  9415082711","f1 transport nagar, Kanpur Road, Lucknow - 226005, near sbi bank"
"National Mechanical and Electr...","+ 91  522 3919024","Kunjbihari, Shop no 46/34, main road, Polytechnic, Lucknow - 226005, Near ma Durga restorent"
"Singh Service Station","+ 91  9792392939","Plot No 2, Kanpur Road, Kanpur Road, LUCKNOW - 226005, Vijay Nagar"
"Gomti Auto Service","+ 91  9450358753","Tikait RAI Talab, Rajaji Puram, LUCKNOW - 226017, Rajajipuram"
"Laxmi Motors","+ 91  522 2465264","570/28-A, VIP Rd, Alambagh, Lucknow - 226005, Virat Ngr"
"Sushil auto pvt ltd","+ 91  7830096009","D-135 Sahara plaza, Patrakarpuram, Gomti Nagar, Lucknow - 226010, Near ford hospital"
"Hari OM Automobile","+ 91  9450068810","Sitapur Road, Sitapur Rd, Lucknow - 226021, Puraniya Tiraha"
"Raj Auto Repairing Centre","+ 91  9026628395","S-6/115, Azad Market, Ghazipur Gaojn, LUCKNOW - 226016"
"S K Auto Sales","+ 91  8574454570","VIP Road, Alambagh, Lucknow - 226005, Gopalpuri"
"J K Motors","+ 91  522 2328606","Vidya Palace, Kursi Rd, Aliganj, Lucknow - 226006"
"Rishabh Automotives Pvt Ltd","+ 91  522 2347106","Faizabad Rd, Misra, Lucknow - 226016, Blk-C,Indira Ngr"
"Saket Car Sales","+ 91  522 2349513","S-3-7-Sl, Indira Nagar, Lucknow - 226016, Kailash Kunj"
"Shri Bhagwati Motors","+ 91  522 2354152","Gopal Auto Bldg, Faizabad Rd, Indira Nagar, Lucknow - 226016, Nr Hal,Blk-C"
"Shri Ganesh Auto Sales","+ 91  522 2352928","Faizabad Rd, Misra, Lucknow - 226016, Nr Hal"
"Sigma Automobiles Pvt. Ltd.","+ 91  522 2721362","7.6 Kms. Faizabad Road, Ismailganj, Lucknow - 226016"
"Bajaj Repairing","","Secter 11,Takrohi Bazar,, Indra Nagar, Indira Nagar, Lucknow - 226016"
"New Deepak Auto Spares","+ 91  9889668749","Puran nagar, bus stop, Kanpur Road, Alambagh, Lucknow - 226005, Near kenra bank"
"R K Automobile","+ 91  9450650719","Shop no-34, Sitapur Road, Daliganj, Lucknow - 226007, Near Galla Mandi"
"Rahul Auto Point","+ 91  522 3296490","Indira Nagar, Lucknow - 226016, Amrapali Mkt"
"Gunjan Motors","+ 91  522 2382285","7, Faizabad Road, Lucknow - 226010, Kailash Kunj"
"Unique Auto","+ 91  522 4010012","Shop No-1 Amous Plaza, Rajaji Puram, Lucknow - 226017"
"CLASSIC AUTOMOBILES","+ 91  9307897611","Shop NO- G- 206 & 207, Sahara trade centre, Faizabad road, Indira Nagar, Lucknow - 226016, Near HAL"
"Sony Music Palace","+ 91  9307756025","F- 215, Sahara Trade Centre, Faizabad Road,Indra Nagar, Indira Nagar, Lucknow - 226016"
"RajShree Automobiles","+ 91  9415425764","Aman Plaza 7/1 Shop No 5, Double Road, Rajaji Puram, Lucknow - 226017, Near Gol Chauraha"
"GUPTA AUTO SPARE PARTS","+ 91  9450555062","Polytechnic Chouraha, Faizabad ROAD, Indira Nagar, Lucknow - 226016, Near Sahara trade center-1"
"Rama Automobiles","+ 91  9795992592","Polytechnic Choraha, Indra Nagar, Indira Nagar, Lucknow - 226016"
"Akash Automobile","+ 91  522 4209999","Thakurganj, Lucknow - 226003, Opposite Manju Tondon Hospital Thakur Ganj"
"Kanchhal Auto Sales","+ 91  522 3091273","Hardoi Rd, Amberganj, Lucknow - 226003, Sarain Mali Khan"
"Republic Automobiles","+ 91  522 2258282","Hardoi Rd, Amberganj, Lucknow - 226003, Hardoi Rd Chowk"
"Sapna Motors","+ 91  522 2245897","Hardoi Road, Thakurganj, Lucknow - 226003, Near Manju Tandan Hospital"
"Javed Automobiles","+ 91  7398885648","Husainabad, Jama Masjid, Hussainabad, Lucknow - 226003"
"Rastogi Automobile","+ 91  9696045323","Shop No-11,Sankat Mochan Market, Opp.klyangiri Mandir, Thakurganj, Lucknow - 226003, Hardoi Road"
"Akshay Repairing","+ 91  9984866520","Hardoi Road, Amberganj, LUCKNOW - 226003, Dubagga"
"Karuna Auto Mobiles","+ 91  9935468688","Hardoi Road, Thakurganj, Lucknow - 226003, Star Plaza"
"Mangal Motors","+ 91  9415283961","VIP Road Nr Pakariyapul, Alambagh, Lucknow - 226005"
"Philips Automobiles","+ 91  522 2418815","7/C-202, Rajaji Puram, Lucknow - 226017, near greenfield school"
"Shahi Automobiles","+ 91  9936877897","Vinay Khand-5, Gomti Nagar, Gomti Nagar, Lucknow - 226002"
"Raju Automobiles","+ 91  9795101752","Takrohi Near Allahabad Banktakrohi Near Allahabad Bank, Indira Nagar, Lucknow - 226016"
"Ekta Motors","","P No 2c/41, Vikas Nagar, Lucknow - 226022, Sec-2"
"Avadh Automobiles Indira Ngr","+ 91  522 2348282","Faizabad Rd, Indira Nagar, Lucknow - 226016, Saidulnisha Ghazipur"
"SRI RAM ENTERPRISES","+ 91  9369905826","SHIVA PLAZA SHOP NO.6, RING ROAD, Indira Nagar Lucknow, Lucknow - 226016, NEAR MUNSHI PULIA"
"Subhash Auto Care Centre","+ 91  9335671823","Asha Complex, Indira Nagar, Lucknow - 226016, C Block, Behind Hanuman Mandir"
"Satyam Auto Mobiles","+ 91  9336150713","No Shop No 1, Kanpur Road, Adarsh Nagar, LUCKNOW - 226005"
"Lucknow Tractors","+ 91  522 2760360","Khurram Nagar Churaha, Ring Road, Lucknow - 226022"
"Prakash Auto Mobiles","+ 91  9336102333","Mal Pua Dubagga, Ring Road, Lucknow - 226022"
"Compact Mktg Service","+ 91  522 2425399","B-13, Kanpur Rd, Kanpur Road, Lucknow - 226012, Sec-C,Nr Nabard,Lda Clny"
"Lucas Indian Service","+ 91  522 2433251","295, Kanpur Road, Lucknow - 226012, Nr 32 Pac Battalion"
"T V Sundram Iyengar & Sons Ltd","+ 91  522 2437125","C-11, Kanpur Road, Lucknow - 226012, Transport Ngr"
"Zeeshan Automobiles","+ 91  9839275540","Jail Road Bangla Bazar, Ashiyana Road, Ashiana Colony, Lucknow - 226012, Opp. Allahabad Bank"
"Pratap Motors","+ 91  9415151141","Campbell Lines, Lucknow - 226002, Bahraich"
"Modern Spair Part","+ 91  9839396949","Purania Cshuraha Behind Petrol Pump, Aliganj, Lucknow - 226002"
"ADITYA AUTO SPARE PART","+ 91  9532223811","Pandey sadan, Sitapur road, Sitapur Rd, Lucknow - 226021, Pandey Sadan kesaw nagar mood near purania crossing"
"Pratap Car Care","+ 91  9335901630","1/33 Bc Vijay Khand, Gomti Nagar, Lucknow - 226002"
"Ayush Dealing Point","+ 91  522 3226950","570/66, VIP Rd, Alambagh, Lucknow - 226005, Nr Singhal Marble"
"Rohit Motors","+ 91  9335916942","Alambagh, Lucknow - 226005, Nr Shiv Shanti Aashram"
"Ganak Motors","+ 91  522 2465465","Ksr Tower, Alambagh, Lucknow - 226005"
"Pintu Auto Centre","+ 91  8957783079","Azad Nagar, Alambagh, Lucknow - 226005, Near Rajpoot Hospital"
"Praveen Auto Services","+ 91  8604291465","Kanpur Road, Alambagh, Lucknow - 226005, United Bank Of India"
"J K Motors Workshop","+ 91  9889899602","Asiya Mau, Balaganj, Campbell Lines, Lucknow - 226002, Near Kamal Tea Shop"
"Jaisawal auto","+ 91  9335217611","206shahara Trade Centre, Faizabad road, Faizabad Road, Lucknow - 226002, Near polytechnic"
"Mr. Automobiles","","Suraj Complex, Ismailganj, Faizabad Road, Lucknow - 226002"
