"Name","Phone","Address"

"Rajat Pharma","+ 91  183 2275883","Shop No 6a, Amritsar - 143001, Dhan Dhan Guru Ram Dass Market, Kucha Dal Khana, Katra Sher Singh"
"Ess Pee Pharma Agency","+ 91  183 2557864","Katra Sher Singh Building Hall Bazar Amritsar, Katra Sher Singh, Amritsar - 143006"
"Care N Cure Pharma","+ 91  183 2580059","Plot Number- 373 A, Mohan Nagar, Amritsar - 143006, Near Sand Market, East Mohan Nagar"
"Shri Gee Vet Pharma","+ 91  183 5014993","Super Market,Furniture Bazar,Near Gain Lassi Wala,Kt.sher Singh,Amritsar., Katra Sher Singh, AMRITSAR - 143006"
"Sahni And Sahni Pharma Distrib...","","Katra Sher Singh, Katra Sher Singh, Amritsar - 143006"
"Ganpati Pharma","+ 91  183 5010006","Katra Sher Singh, Katra Sher Singh, Amritsar - 143006"
"A. B. Pharma","","Katra Sher Singh, Katra Sher Singh, Amritsar - 143006"
"Fair Pharma","","Katra Sher Singh, Katra Sher Singh, Amritsar - 143006"
"Indra Sehgal Pharma","+ 91  183 5008648","Katra Sher Singh, Katra Sher Singh, Amritsar - 143006"
"YOG Ratan Pharma","+ 91  183 2534851","Katra Sher Singh, Katra Sher Singh, Amritsar - 143006"
"S.P. Pharma","","1st Floor, Dav College Parking, Katra Sher Singh, Amritsar - 143006, Katra Sher Singh"
"Rameshwar Pharma","","Katra Sher Singh, Katra Sher Singh, Amritsar - 143006"
"Approach Pharma","+ 91  9217728400","39, Chaudhary Plaza, Amritsar - 143001, Nr Nandan Cinema"
"Pharma Machines & Polymers","+ 91  183 2588373","228, Mehta Rd, Amritsar - 143001, Focal Point"
"Garg Pharma","+ 91  183 2556875","Amritsar - 143001"
"Med Fox Pharma Pvt Ltd","+ 91  183 2580925","423, Amritsar - 143001, Focal Point"
"Hs Herbs","+ 91  183 2530192","Bagh Jhanda Singh, Majith Mandi, Amritsar - 143001, Po: Golden Temple"
"SHIVA PHARMA","+ 91  9872815928","Jinda wala chowk, Amritsar - 143001, I/s Hakima gate"
"Amit Pharma","+ 91  183 5005168","Katra Sher Singh, Amritsar - 143006"
"Arun Pharma","+ 91  183 3093763","Katra Sher Singh, Amritsar - 143006"
"Mahaveer Pharma","+ 91  9814802314","No-60-B, Rani Ka Bagh, Rani Ka Bagh, Amritsar - 143001, Amritsar"
"Jolly Pharma","+ 91  9855776711","Amritsar - 143001"
"Yorks Pharma","+ 91  183 2711880","Fatehgarh Churian Road, Amritsar Bus Stand, Amritsar - 143001, Near Brindaban Garden,,21milestone"
"Munish Herbs","+ 91  183 2556037","G-20, Amritsar - 143001, Majith Mandir"
"Ess Pee Pharma Agencies","+ 91  183 2557867","1347, Katra Sher Singh Building, Amritsar - 143002"
"Sidharth Drug Pharma","+ 91  183 6572137","Batala Road, Amritsar - 143001, Bharat Nagar, Opposite HDFC Bank"
"Dhamus Pharma","+ 91  183 5067250","Shop No 1-2, Harman Market, Katra Sher Singh, Amritsar - 143006"
"Anmol Pharma","+ 91  183 5005044","near himayal dhaba, raja markit, Katra Sher Singh, Amritsar - 143006, Hall Bazar"
"Shri Kesari Nandan Pharma","+ 91  183 2533038","shop no 5.,, Kucha Dai Khana, Katra Sher Singh, Amritsar - 143006, near Kapoor Market katra sher singh"
"Aryaan Herbs","+ 91  183 2555111","Aryaan Herbs, Majith Mandi, Majitha Mandi, Amritsar - 143006, Opposite Bank Of India"
"Gmk Pharma","+ 91  9878664400","Katra Sher Singh, Katra Sher Singh, Amritsar - 143006"
"Piyush Pharma","+ 91  183 2542157","katra sher singh, Katra Sher Singh, Amritsar - 143006, Near Khera Collage,Kucha Dai Khana"
"Vee Bros Pharma","+ 91  183 5093235","2078/2, Himalaya Dhaba, Katra Sher Singh, Amritsar - 143006, Kucha Dalghana,Near Doctore Sohan Eye Hospital"
"M B Pharma","+ 91  183 2558428","Partap Street, Majitha Mandi, Amritsar - 143006, Near Goverdhan Mandir"
"Pharma Sales","+ 91  1858 2544619","1350/10, Kucha Dal Khana, Raja Sansi, Amritsar - 143101"
"Narang Pharma","+ 91  9864651654","Katra Sher Singh, Raja Sansi, Amritsar - 143101"
"N B Pharma","+ 91  9855193312","Taylor wali gali, rayya, Amritsar - 143112, near railway line"
"prime pharma,","+ 91  9988037550","kA /1, KRISHNA NAGAR, Amritsar - 143002, TARANTARAN ROAD"
"Vng Pharma","+ 91  9814572126","Shop No-2,1st Floor, Amritsar - 143002, Swami Market,Katra Sher Singh"
"Om Pharma","+ 91  9888280239","Om Pharma, Amritsar - 143002, Infront Of Gate No-3 Telephone Exchange"
"Whiteline Pharma","+ 91  7432594170","Amritsar - 143002, Near Indra Palace Cinema"
"Raj Pharma","+ 91  183 2720558","Sco-165-69, Sec-9-C,, Amritsar - 143002"
"Himalchal Durg Pharma","+ 91  9021654654","Bz, Gandan Wala, Amritsar - 143002"
"SHIVAM PHARMA","+ 91  9417012120","house no.58, krishna square-3, Amritsar - 143001, celebration mall"
"Vishal Pharma Sales","+ 91  183 2544612","Shop Number- 1348/10, katra shersingh Kucha Daikhana amritsar, Amritsar - 143001, Kucha Daikhana"
"r.s medi pharma","+ 91  183 5068282","15 haram market, katra sher singh, Amritsar - 143002"
"ZABI PHARMA","+ 91  9888333878","KUMAR MARKET SHOP NO. 4, KATRA SHER SINGH, Amritsar - 143002, MEDICINE MARKET"
"chirgan pharma","+ 91  9814004181","shop no 18 1st floor, harman mkt katra shersingh, Amritsar - 143002, harman mkt"
"Upjohn Pharma","+ 91  9876040403","Main bazar, Partap nagar, Amritsar - 143002, g.t road"
"Sonu Pharma","+ 91  183 3243536","Shop No 4 Khanna Mkt Kucha Dai Khana, Katra Sher Singh, Amritsar - 143006"
"S D Pharma","+ 91  183 5058852","1405, Katra Sher Singh, Amritsar - 143006, Kucha Dai Khana"
"A S Wehgal Pharma","+ 91  183 2530550","Shop No-7, Katra Sher Singh, Amritsar - 143006, Harman Market,"
"Pharma General Traders","+ 91  183 2555532","Katra Sher Singh, Amritsar - 143006"
"Satyam Pharma","+ 91  183 5050346","Shop No-3, Katra Sher Singh, Amritsar - 143006, Dhanguru Ramdas Market, Gali Kuchha Dai Khanna"
"Joshi Pharma Chemist & Druggists","+ 91  183 2553557","2056/12, Katra Sher Singh, Amritsar - 143006, Kucha Daikhana, Hall Bazar"
"Chohan Pharma","+ 91  183 5006821","No.5, B D Market,, Amritsar - 143001"
"Great Pharma","+ 91  9815268354","Amritsar - 143001, Kucha Dal Khana, Katra Sher Singh"
"Shrijan Pharma","+ 91  9814004181","Amritsar - 143001"
"Bandhu Pharma","+ 91  183 2558929","No.5, B D Market, Amritsar, Amritsar - 143001"
"The Jain Homoeopathic Pharma","+ 91  183 2556777","Mahna Singh Road, Amritsar - 143001, Nr Jallianwala Bagh"
"Radhika Pharma Distributors","+ 91  183 2210213","379, Gali Number-2, Amritsar - 143001, Model Town Near Amandeep Hospital"
"Standard Pharma","+ 91  183 2534233","Shop No-15, Katra Sher Singh, Amritsar - 143006, Opposite Khera College, Kucha Dat Khana"
"K K Pharma","+ 91  183 3112204","47, Hide Road Singh Complex, Near Hussainpura Chowk, Amritsar - 143001"
"Om Pharma","+ 91  183 2425342","Katra Sher Singh, Amritsar - 143001, Telephone Exchange"
"Bio Pharma","+ 91  183 2551035","Katra Sher Singh, Amritsar - 143006"
"Shakti Pharma","+ 91  183 2542509","Katra Sher Singh, Amritsar - 143006"
"Sonu Pharma","+ 91  183 5063425","Katra Sher Singh, Amritsar - 143006"
"Sa Sanctifier Pharma","+ 91  9417277462","Shop No-3 1st Floor Swami Market, Katra Sher Singh, Amritsar - 143006"
"Sethi Pharma","+ 91  183 2543672","Shop Number-15, Katra Sher Singh, Amritsar - 143006, New Medicine Market"
"Aman Pharma","+ 91  183 5093136","Katra Sher Singh, Amritsar - 143006"
"Union Pharma","+ 91  183 2543686","Katra Sher Singh, Amritsar - 143006, Kucha Dai Khana,Near Hall Bazar"
"Deep Pharma","+ 91  183 5096479","Shop Number 2, Katra Sher Singh, Amritsar - 143006, Khanna Market"
"Bhasin Pharma","+ 91  9814152854","2488/12, 1st Floor, Katra Sher Singh, Amritsar - 143006, Near Dav College"
"Gagan Pharma","+ 91  183 5010107","inside hall gate,khana market, Katra Sher Singh, Katra Sher Singh, Amritsar - 143006"
"Boi Pharma","","Schea No. 2, Katra Sher Singh, Amritsar - 143104"
"A K Pharma","+ 91  183 5069856","9, Amritsar - 143001, Shree Guru Dass Market, Kucha Dal Khana, Katra Sher Singh"
"Anish Pharma","+ 91  183 2555944","No.1, Mahajan Market,, Amritsar - 143001"
"Shree Ram Pharma","+ 91  183 5003570","Cheel Mandi Amrisar, Amritsar - 143001"
"Ayush Pharma","+ 91  183 2545197","Harman Market, Amritsar, Amritsar - 143001"
"Dhananjay Pharma","+ 91  183 2291440","No.6, G R D Market,, Amritsar - 143001"
"Gagan Vet Pharma","+ 91  183 5069885","Gali Kucha Dai Khana,, Amritsar - 143001, Katra Sher Singh"
"V P Rogantak Pharma","+ 91  183 5016057","106, Tilak Nagar, Amritsar - 143001"
"A P Pharma","+ 91  183 2558089","No.5, Harman Market,, Amritsar - 143001"
"Cure Pharma","+ 91  9815262376","41- Industrial Estate, P.O. Rayon & Silk Mills, Chheharta, Amritsar - 143001"
"Humed Pharma","+ 91  183 2560377","No.A-3, Canal Road, Amritsar - 143001"
"Shri Krishna Pharma","+ 91  183 5012746","Shop No-3, Gali Deputy Aziz Din, Amritsar - 143001, Katra Sher Singh,Krishna Medicine Mkt"
"Chandan Drugs Pharma","+ 91  288 2500052","Plot M-27, Amritsar - 143002, Gate Number- 3, Green Avenue,Near Holiheart School"
"The Jain Homoeopathic Pharma","+ 91  183 2554469","Pink Plaza Market, Amritsar, Amritsar Road, Amritsar - 143001, Out Side Of Hall Gate"
"Lebon Pharma","+ 91  183 3951860","Katra Sher Singh, Amritsar - 143006"
"Bhagwati Pharma","+ 91  183 2306873","Katra Sher Singh, Amritsar - 143006"
"Prabhat Pharma","+ 91  183 5004067","Shop Number-1, Building Number- 68, Katra Sher Singh, AMRITSAR - 143006, Medicine Market, Near Subhash Park"
"NEO Herbs Pharma","+ 91  183 2744014","Vpo Jethuwal, Amritsar - 143001"
"Neo Expressionist School of Art","+ 91  9988827799","1st Floor, Upstairs HP Jewellers, Rani Ka Bagh, Amritsar - 143001, Near Sensations"
"NEO TECH COMPUTER REPAIR","+ 91  9888646455","R-15, Daya Market, Gt Road, Amritsar - 143001, Near shah di hatti"
"Neo Tech Computers Repair","+ 91  183 5052002","R-15, Daya Market, Hide Market,, G T Road near bus stand, Amritsar Bus Stand, Amritsar - 143001, Near Post Office,"
"Neo Flavours","+ 91  9317727772","38, SGTB Estate, Mehta road, Mehta, Amritsar - 143114, Opp. SGRD Hospital"
"Sajan Herbs Pharma","+ 91  9356030161","Ram Tirath Road, Amritsar - 143002, Opposite DTO Office"
