"Name","Phone","Address"

"Aashadeep group of education","+ 91  1883 249171","Mukerian, Hoshiarpur - 144211, Opposite Post Office Thana Road"
"ACPL","+ 91  8800447899","Flat Number 103, Vasant Kunj, Delhi - 110070, Kishangarh"
"Sai Baba Consultancy","+ 91  9793059991","5,new Silvart Ganj,prem nagar, Sipri Bazar, Jhansi - 284003, infront of Punjab national bank"
"Excel Education","+ 91  172 5044581","SSS 88, Phase 9, Mohali, Chandigarh - 160062, Near Majestic Hotel"
"A V Immigration And Careers...","+ 91  20 41504110","B 14/15 5th Avenue, Dhole Patil Road, B S Dhole Patil Road, Pune - 411001, Near Quality Hotel Opposite Reliance Web World"
"Sanjivani Education","+ 91  9214343661","772, Mangal Bhawan Shastri Nagar, Dadabari Main Road, Dada Bari, Kota-Rajasthan - 324009"
"Bright Future Abroad Studies","+ 91  7206671815","Model Town, Rohtak - 124001, Opposite Paramount Coaching Center"
"Local Guardian And Educatio...","+ 91  744 2421140","MPB-14,17, Mahaveer Nagar I, In front of Rajeev Gandhi nagar, Mahaveer Nagar, Kota-Rajasthan - 324005, Near narcotic office"
"Patel Education Trust","+ 91  2692 290610","Third Floor Radha Swami Pawan, Bhalej Road, Anand - 388001, Near Mahendra Shah Hospital Opposite N S Patel College"
"Iirma Education Consultancy...","+ 91  79 23245688","313, Kailash Sagar Complex, Gandhinagar Sector 22, Gandhinagar-Gujarat - 382022, Below SBI Bank, Near Gh 5"
"NMC The Intellect Consultancy","+ 91  9530065111","Sindhu Nagar Main Road, Bhilwara - 311001"
"Make My Future Career Guida...","+ 91  8963897045","Shop No 9,1st Floor,Gokul Plaza, indra Market, Jaisalmer - 345001, Near Hotel Haveli, Bhilwara(Raj.)"
"Educatter","+ 91  7373333916","No 3/79 Adidravidar Street, Samayasangili,Agraharam, Samayasangiliagraharam, Namakkal - 638008"
"Alpha Mary International Ad...","+ 91  471 2341111","Karamana, Thiruvananthapuram - 695002, near market bus stand junction"
"Sumeera Sikdha Foundation","+ 91  571 6500650","1st Floor, Krishna Complex, Sasni Gate,Agra Road, Aligarh - 202001, Near Canara Bank"
"The ambitious overseas educ...","+ 91  9860482690","chintamani appartment, narendra ring road, Narendra Nagar, Nagpur - 440015, Besides tukaram hall"
"Sdk Consultancy","+ 91  9001115182","flat no. 302, plot no. 13, Radha Krishan Residency,, path no. 7, vijaybari, Sikar Road, Jaipur - 302039, behind khaitan hospital"
"Panache Immigration & Educa...","+ 91  181 4673999","First Floor 1201, Main Road, Bmc Chowk, Jalandhar - 144006, Near To Nakodar Chowk"
"Shri Guru Educational Services","+ 91  9229224499","8/2 Yash Apartment, Dhobi Ghat Road, New Palasia, Indore - 452001, Opposite Sushant Girls Hostel"
"New Life Education Academy ...","+ 91  8147105980","Upstairs SKM Medical, Railway Station Road, Station Road, Raichur - 584102, Opposite West Police Station"
"Global Consultancy","+ 91  294 2494050","5-6, Udaipur, Udaipur-Rajasthan - 313004, Near Girls Gym, Bohra Ganesh Ji Choraya,Sharda Nagar"
"FUTURE CAREER","+ 91  8811005068","Chakraborty Book Stall, Bihupuria, Lakhimpur - 784161, Near Police station"
"Balaji Educational Society","+ 91  326 6555509","Simna Complex, Naya Bazar, Dhanbad - 826001, Near Subhas Chowk"
"Global Focus Education Group","+ 91  674 2546500","Plot 382, 1st Floor, Bhoinagar, Bhubaneshwar - 751022, Near Saheed Nagar Police Station"
"Dronacharya Group","+ 91  9001099110","Dronacharya Tower, F 799, Main Road Shastri Nagar, Bhilwara - 311001"
"Valmiki Foreign Education","+ 91  9373705454","402 Royal Rudra Apartment, Hingana Road, Nagpur - 440016, Near Mansi Girls Hostel"
"Career Engine","+ 91  7387577770","Hinjewadi, Pune - 411057, Near Alard College"
"Indian Career Consultants","+ 91  9314282444","20-21, Lbs Market, Bhilwara - 311001, Near Gol Pyau Choraha"
"Kanasu Groups","+ 91  8884793959","rajathadri no41/59, 1st floor, csi layout, Bh Road, Tumkur - 572102, behind malabar gold and diamond"
"Rusasia Pvt. Ltd.","+ 91  657 2422216","1st Floor, Jaiswal Complex, Kasidih, Sakchi, Jamshedpur - 831001, Mansarovar Hotel"
