"Name","Phone","Address"
"Manohar Lal Rattan Lal","+ 91  183 5533726","Shop No 37, Amritsar - 143001, Shed No 3, New Sabji Mandi"
"Barkat Ram Amrit LAL","+ 91  183 2564033","Hukum Singh Road, Amritsar - 143001"
"Kasturi LAL & Co","+ 91  183 2552212","57,, Gali Sunirian Wali Tahli Sahib Bazar Shastri Marke, Amritsar - 143001, Near Post Office"
"State Bank Of Patiala ATM","18001802010","J K Tower, Mall Road, Amritsar - 143001, Civil Lines"
"House of precure","+ 91  9814779990","Amritsar - 143001"
"Chunni lal Ashok Kumar","+ 91  9872644413","Amritsar - 143001"
"Channakya Academy Of Commerce","+ 91  9814793863","182 B 2f, Rani Ka Bagh, Amritsar - 143001, Main Road"
"State Bank Of Patiala ATM","18001802010","Amritsar-Taran Taran Road, Amritsar - 143001, Chatiwind Gate"
"Chanakya Coaching & Computer I...","+ 91  183 2223232","456, Majitha Road, Amritsar,, Amritsar - 143001"
"Tulec Computer Education","+ 91  183 2212346","Lawrence Road, Amritsar,, Amritsar - 143001"
"J S Memorial School","+ 91  183 2702000","Main Road, Amritsar - 143001"
"Dr Sardari LAL Tondan","+ 91  183 2425117","475 A Basant Nagar, Majitha Road, Amritsar - 143001, Near Sv Memorial College Of Nursing"
"Central Bank Of India ATM","18002001911","Cemetary Road, G T Road, Amritsar - 143001, Pultighar"
