"Name","Phone","Address"

"Chand Ciment store","+ 91  9855076857","Gali no 3 Hargobind pura, Hakima Gate, Amritsar - 143006, opp.Dhobi ghat"
"MOHINDER SINGH & CO","+ 91  9815858529","Circular Road, Hakima Gate, Amritsar - 143006, Opp. Thana gate hakima"
"Gosal Cement Store","+ 91  9855203619","Majitha, Amritsar - 143601, Near Bus Stand"
"D K Trading Co Pakistani Cemen...","+ 91  183 5008126","G.T Road, Chheharta, Amritsar - 143105, Nr . SBI And Opp. HDFC Bank"
"DIAMOND BRICK SUPPLIER","+ 91  9988109700","SH NO 26, RANJIT AVENUE, Ranjit Avenue, Amritsar - 143001, NEAR LA PESSTRIES"
"Chopra building material","+ 91  9988587782","Guru ka bhag, Amritsar - 143001, ajanala road"
"Bharat Cement & Saniatary Store","+ 91  183 2271679","Bedi Mension, Majitha Road, Amritsar - 143001, Opp. Mahajan Palace"
"Exports First Pakistani Cemen...","+ 91  183 5008943","Shop No.29, Batala Road ,, Amritsar - 143001, Opposite Petrol Pump"
