"Name","Phone","Address"

"Rakesh Building Works","+ 91  9464052923","Jugial Road, Hoshiarpur - 146001, Near Five Star Tailor"
"Navjot Traders","+ 91  9814533284","Tanda Road, Hoshiarpur - 146001, Near Bye-pass,Opposite Dhami Dharam Kanda"
"Lalit Cement & Sanitary Store","+ 91  1882 263431","Sham Chaurasi, Hoshiarpur - 144105"
"aggarwal marble & sanitary store","+ 91  1883 244039","Mukerian, G T Rd, Mukerian, Hoshiarpur - 144211"
"Tuli Cement Store","+ 91  9464194900","ajay198115@gmail.com, Tanda, Hoshiarpur - 144203, Nr. Sub Tehsil"
"Dashmesh Ambuja Cement Store","+ 91  1883 251117","dasuya, Bodal Garna Sahib, Hoshiarpur - 144205, PSB, Mushiana, dharampura near"
