"Name","Phone","Address"

"The Gera Cooperative Agriculture","+ 91  9814182463","Hoshiarpur - 146001"
"ROYAL STUDY HUB ( An educat...","+ 91  9653932199","206,208 II Floor Grand Mall, Hoshiarpur - 146001, Near BMC Chowk , Jalandhar"
"National Agriculture","+ 91  9815748000","Hoshiarpur - 146001"
"The Bakapur Guru Cooperative A","+ 91  9501167503","Hoshiarpur - 146001"
"The Nangal Kalan Cooperative A","+ 91  9814004392","Hoshiarpur - 146001"
"Ashirwad Agriculture Farm","+ 91  1882 292929","Hoshiarpur - 146001, Vpo Bassi Purani"
"Garg.Com The General Store","","B-9 585/2,, Near Mitha Town, Hoshiarpur - 146001, Near Model Town"
"Partap Agriculture Traders","+ 91  9417478826","Afgan Road, Hoshiarpur - 146001, Chara Mandi"
"Home For The Aged And Infirm","+ 91  1882 222417","1, Ram Colony Camp Chandigarh Road, Hoshiarpur - 146001, Main Road"
"The Jhaji Pind Cooperative Agr","+ 91  9465393382","Hoshiarpur - 146001, near govt sr sec school"
"The Garhi Mansowal Cooperative","+ 91  9815952817","Hoshiarpur - 146001"
"The Marulla Co Operative Agric...","+ 91  9417847007","Hoshiarpur - 146001"
"The Jhajj Cooperative Agricult","+ 91  9463287137","Hoshiarpur - 146001"
"Paridhan The Fashion Shopee","+ 91  9988117373","Gaurain Gate, Hoshiarpur - 146001"
"Much More The Fashion Hub","+ 91  9417691461","Sutehri Road, Hoshiarpur - 146001, Near Session Chowk"
"Shalu Handtools Agriculture Im...","+ 91  1882 501012","House No-58, Ward No-5,, Hoshiarpur - 146001, Sarhalla Road, Gardhiwala"
"Ruddra Agriculture Industries","+ 91  9257241324","Near Libra Motors,, Jalandhar Road,, Hoshiarpur - 146001"
"New Moga Agriculture Industries","+ 91  9463906101","Industrial Area, Hoshiarpur - 146001, Opp ITI Jalandhar Road"
"Anil Kumar Gera","+ 91  1882 238169","Bar Asociation Hoshiarpur, HOSHIARPUR - 146001"
"G S Agriculture Industries","+ 91  1882 251222","10 A Ind Estate, Hoshiarpur - 146001, Jalandhar Road,"
"Aroma Beauty Clinic & The Prof...","+ 91  1882 242117","H No - 14-L, Lane No:- 3, Hoshiarpur - 146001, Gautam Nagar"
"Trendz The Boutique","+ 91  1882 245656","Fatehgarh Chungi, Raheem Pur Road, Hoshiarpur - 146001, Near Uppal Hospital"
"Lovely Agriculture Engg Works","+ 91  1882 224160",""
"Hi Tech Agriculture Engineerin...","+ 91  9417395353","Purhian, Phagjwara Road, Purhiran, Hoshiarpur - 146111, Hoshiarpur"
"Doaba Agriculture Impalements ...","+ 91  9463379600",""
"Suraj Agriculture Store","+ 91  9464783899","railway road, Garhshanker, Hoshiarpur - 144527, Opp municipal committe"
"RCF Cooperative Consumer Store","+ 91  1882 228976","Rail Coach Factory Complex,, Hussainpur, Hoshiarpur - 144602"
"WOW THE ART WORLD","+ 91  9888116281","Hoshiarpur - 144521"
