"Name","Phone","Address"

"A One Store","+ 91  9803683405","22 Number Railway Fatak Road, Amritsar - 143001, Opposite Dashmesh Academy"
"Healthway Immigration Consulta...","+ 91  183 2505965","deep complex, Amritsar - 143001, Ranjit Avenue"
"A-One Kulfa","+ 91  9872101109","Queens Road, Amritsar - 143001"
"Computer solution","+ 91  9356166556","59, Chand avenue circular road, Amritsar - 143001, Near Medicaid hospital"
"Perfect Solutions","+ 91  9888497291","Sabharwal Market, Sabharwal Street, Hall Bazar, Amritsar - 143001, Opp. Jama Masjid"
"STOP N SHOP","+ 91  9779234527","S C G , D- 20, D block ranjit avenue, Ranjit Avenue, Amritsar - 143001, Near Danik bhaskar office"
"S.B solutions","+ 91  183 5003683","13, Amritsar - 143001, near daveser college"
"WIfi solutions","+ 91  8427897777","Amritsar - 143001"
"guru it solutions","+ 91  9814972420","kirpal colony, majitha road, Amritsar - 143001"
"HIGH TEK COMPUTER SOLUTIONS","+ 91  9814492094","#345, satguru ramdass avenue, Amritsar - 143001, Near KHALSA COLLEGE"
"M.i computer solution","+ 91  183 5063480","Shop no 43gf, Nehru shopping complex, Lawrence Road, Amritsar - 143001, Near bhabha photostudio"
"Gulf Immigration Services","+ 91  8528945383","Sco-8, 3rd Floor, District Shopping Complex, B-Block, Ranjit Avenue, Amritsar - 143001"
"Murria Immigration Consultant ...","+ 91  183 2227327","18, Cool Rd, Amritsar - 143001, Modern Clny,Nr BMC Chowk"
"Hcm Solutions","+ 91  183 5015408","Adjoining Union Bank Of India, Gumtala, Airport Road, airport road, gumtala, Amritsar - 143001, near petrol pumb"
"Micron Solar Solutions","+ 91  9814103256","47, Hide Market, Hide Market, Amritsar - 143001, Hussainpura Chowk"
"I Kare Tech Solutions","+ 91  9872489090","Kothi No 16 A, Circular Road, Amritsar - 143001, Ekta Avenue"
"Orango Solutions","+ 91  9872222222","No. 107, Lawrence Road, Amritsar - 143001"
"Expert Educare Solutions","+ 91  8559044081","1, basant avenue, Amritsar - 143001, near nayer hospital"
"Totaltrans solutions pvt ltd","+ 91  9872903268","2986/44, I/s shera wala gate, Amritsar Bus Stand, Amritsar - 143001, Back side daljit singh eye hospital"
"A One Snacks Corner","+ 91  9988940037","Booth Number 65 B Block, Ranjit Avenue, Amritsar - 143001, Opposite M .K Hotel"
"Sixth Sense Astro & Vastu Solu...","+ 91  8437372211","Amritsar Plywood Place, Chowk Islamabad, Amritsar - 143001, Opp Punjab & Sind Bank"
"Jasbir Singh And Sons Interior...","+ 91  9815455859","Amritsar - 143001, Cheel Mandi, Near Bus Stand, Maha Singh Gate"
"Tranceserve IT Solutions","+ 91  9815145656","Kachehri Chowk, Kichloo Chowk,, Amritsar - 143001"
"Sps Solution Pvt Ltd","+ 91  9814825227","Shop No: 1, 1050 Friends Colony, 88 Ft. Road, Amritsar - 143001, B/S. Sacered Heart School, Majitha Road"
"Achiever Point Immigration Con...","+ 91  9855114042","Gill Complex, Gali Janta Place Wali, Amritsar - 143001, Taran Taran"
"A One Chaamp","+ 91  9217967915","Amritsar - 143001, Lohgarh Gate, Opposte Graduate Gas Agency"
"Diagnostics Solution Point","+ 91  183 5098222","Shop No-1390, Amritsar - 143001, Sharifpura,Rani Bazar, Near Kamal Tailor"
"Mohini Solution Pvt Ltd","+ 91  183 3502550","Number 36 B Block Second Floor District Shopping Complex, Amritsar - 143001"
"Biomatics Office Solutions","+ 91  9814374757","8 East Mohan Nagar,, 100 Feet Road ,Amritsar Ho,, Amritsar - 143001, Near Railway Station"
"Stop & Look Restaurant","+ 91  9814503001","2,, Gt Road, Nh1 ,Amritsar,, Amritsar - 143001, Near New Amritsar"
"Biotap Info Solutions Pvt. Ltd.","+ 91  183 2505547","124b, Ranjit Avenue, Amritsar - 143001"
"Karra World Wide Immigration C...","+ 91  183 4612212","Amritsar - 143001, Nr. Bus Stand"
"Pacific Power Solution","+ 91  183 5068813","149 Guru Ramdas Mkt. O/S Ghee Mandi Chk Nr. Petrol Pump, Amritsar - 143001"
"Smartway Immigration Consultant","+ 91  9417066504","Amritsar - 143001, Nr. Friend Cinema"
"A-One Travels","+ 91  183 2548988","Amritsar - 143001, Suraj Chanda Cinema"
"A-One Diagnostic Lab","+ 91  9855350982","New Adda Raja Sansi, Airport Road, Amritsar - 143001"
"Codified Solutions","+ 91  9855021977","2, Rattan Chand Rd, Amritsar - 143001, The Mall,Nr Ebony"
"Secure Solutions","+ 91  183 5005953","Mall Road, Joshi Nagar, Amritsar - 143001, Opp. Ritz Plaza"
"SR SOFTWARE SOLUTIONS AVNEET S...","+ 91  183 5065966","ISO 9001:2008, 313 second floor ,Link plaza market, Hall Bazar, Amritsar - 143001, I/s sarai sant ram"
"Roshni Immigration & Education...","+ 91  183 2560926","Super Plaza, Cooper Road,, Amritsar - 143001, Cristal Chowk Toward Bridge Left Side."
"Kemflo Water Solutions","+ 91  9316677544","Ranjit Avenue, Amritsar Head Office,, Amritsar - 143001"
"Web World Solutions Inc","+ 91  9646946016","Amritsar, Amritsar - 143001"
"A one telecom","+ 91  9814324114","Fatehgarh Churian Road, Amritsar - 143001, Near Life Kare hospital"
"Vivah Solutions","+ 91  183 2583316","Katra Jaimal Singh, Amritsar - 143001"
"Gravitas Security Solutions","+ 91  9888263309","SS Towers 2nd Flr Building No 59, Majitha Rd, Amritsar - 143001, Opp ENT Hospital, Nr Pertrol Pump,Doctors Cplx"
"Computer Multivision Solution","+ 91  183 2255495","10, 1st Floor, Bhaita Market, Amritsar - 143001, Bus Stand"
"Multi Vision Computer Solution","","1st Floor, Bhatia Market, Opp- All India Women Conference, Bus Stand, Amritsar, Amritsar - 143001"
"First Alert Security Solutions","+ 91  9914136855","Gurnam Nagar, Peera Wala Bazar, Amritsar - 143001, Near Park, Swr"
"Smartway Solutions Pvt Ltd","+ 91  9023311116","SF-19, Sant Ishar Singh Nagar, Pakhowal Road, Amritsar - 143001"
"A-One Transfarmer","+ 91  9892091977","Hall Bazaar Congress Bhawan, Amritsar - 143001"
"Kunal Water Solutions","+ 91  9815114592","Near Railway Station Chowk, Amritsar - 143001"
"Beas Software Solutions","+ 91  183 2504883","Rbkc Towers, Mcleod Road, Amritsar - 143001, Rani Ka Bagh"
"SN IT Solutions","+ 91  8437007785","Amritsar - 143001, Raghunath Mandir Chowk, Near AP Electronic, Islamabad"
"Ahuja Financial Solutions","+ 91  9814049871","18, Amritsar - 143001, Krishan Garh, Inside Chattiwind Gate"
"SAI Immigration","+ 91  7508983007","Amritsar - 143001"
"Danish Immigration Consultants","+ 91  183 5014005","Shop No 88-89 Kabir Market, Opp HDFC Bank, Amritsar - 143001, Near King Palace"
"A K Investment Solution","+ 91  9915434872","H No 1331, Gali Jand Wali Teh, Amritsar - 143001"
"Sidhjogi Totall IT Solution","+ 91  9257048277","Amritsar - 143001, Nawan Kot Main Bzar, Opposite Sharma Hospital"
"Guru Kirpa Jyotish & Vastu Sol...","+ 91  9217718455","Shop No.11, Amritsar - 143001, Johar Market,Pratap Avenue"
"Unlimate Solutions","+ 91  9815952182","Sharifpura, Amritsar - 143001"
"webs cart Solution","+ 91  9464230007","City Centre, Amritsar - 143001"
"Vision One","+ 91  183 2224457","Rani Ka Bagh, Amritsar - 143001"
"Jyotish & Vastu Solution","+ 91  9501926052","NR. Bus stand, Amritsar - 143001"
"Kushal Internet Solutions","+ 91  7696152975","# 89, 4th Floor,, District Shopping Complex, Amritsar - 143001, Ranjit Avenue..."
"techno solution","+ 91  9803502949","plot no.-1,akash vihar, alpha 1 mall, Amritsar - 143001, opst sultanvind canal"
"Zigsee Web Solutions","+ 91  7307802631","Amritsar - 143001"
"A-One Beauty Salon & Training ...","+ 91  9814721253","H.No.49, Gali No.15, Guru Teg Bhadur Avenue, Amritsar - 143001, Mahita Road"
"Worldwide Immigration Consulta...","+ 91  183 6616200","Sco-112,ICICI Bank Bldg, District Shopping Centre, M K Hotel Rd, Amritsar - 143001, Ranjit Avenue"
"solutions for shaadi","+ 91  183 2345678","Hall Bazar, Amritsar - 143001"
"Good Luck Courier and Cargo So...","+ 91  183 2531369","shop no-9,gali jarau.Gampati market, Katra Ahluwalia,Amritsar, Amritsar - 143002, Nr Raghunath mandir"
"VISION IMMIGRATION & EDUCATION...","+ 91  183 5065348","102,Sunrise Plaza, Crystal Chownk ,Cooper Road, Amritsar - 143001, Near Nokia Care"
"Aaghaz Attainments Manpower So...","+ 91  9888039114","3rd Flr, Singh Complex, Hussainpura chowk bus stand, Hussainpura, Amritsar - 143001, near post office"
"Sekhri Academy & Immigration Ltd.","+ 91  9569101112","Sco-37, 1st Floor, Dist. Shopping Complex, Block-B, Ranjit Avenue, Amritsar - 143001"
"sr software solutions","+ 91  9878134973","shop no 47, pink plaza market, Pink Plaza Market, Amritsar - 143001, near pbn school"
"Counsel One","+ 91  183 5003637","SCO-15, Basement Floor, B-Block, Ranjit Avenue, Amritsar - 143001, near Mundh Hospital"
"Perfect Solution Consultancy","+ 91  8557000781","# 170,, Bhullar Avenue, Amritsar - 143002, Opp Bajwa Hospital"
"A one punjabi jutti","+ 91  9872596456","Shop no 24, O/s hall gate, Hall Bazar, Amritsar - 143001, Near Yashika Travels"
"British House Language School ...","+ 91  183 5015105","110 Basement Floor, New Lawrence Road, Lawrence Road, Amritsar - 143001, Beside Sharma Sweets Opposite Bbk Dav College"
"Digital Solutions","+ 91  183 2254511","Scf-23, 2nd Floor, Shopping Complex, AMRITSAR - 143001, Kabir Park, Opposite Gndu"
"A-One Cosmetics","+ 91  9646466420","Lawrence Road, White Avenue, Amritsar - 143001, Near Nehru Shopping Complex"
"G S Investment Solutions","+ 91  183 5010841","2nd Floor, Amritsar - 143001, Opp. Amrit Talkies"
"Immigration Law Office","+ 91  9815210114","Amritsar - 143001, Ranjit Avenue"
"Xpert E Solutions","+ 91  183 2500196","Sh-3,Shah Cplx, Amritsar - 143001, Opp Dav College,Nr Hathi Gate"
"The global solution","+ 91  9814163866","Shop no 3, Kairon market, Amritsar - 143001, Hall bazar"
"Home Solution","+ 91  9888820600","8 B, Maqbool Road, Amritsar - 143002"
"Diabetic World Solutions","+ 91  9888447598","Shop number 60, 2nd floor, Nehru shopping complex, Lawrence Road, Amritsar - 143001, Near novelty chowk"
"A ONE OPTICAL","+ 91  9780201467","Hussainpura, Amritsar - 143001, Near shivala phatak"
"DW SERVING SOLUTIONS","+ 91  9780038619","Ranjit Avenue C Block, Ranjit Avenue, Amritsar - 143001, Near Hug Ice Cream Parlour"
"3RD Eye Security Solutions","+ 91  9814455400","41-A, Nehru Shopping Complex, Amritsar - 143001, Lawrance Road"
"Fly Dreams Immigration Consult...","+ 91  183 5002444","SCO 33, 2nd Floor District Shopping Complex, Amritsar - 143001, B-Block, Ranjit Avenue"
"The British Library & Immigrat...","+ 91  8872890000","Sco 123/124,Nr Vishal Mega Mart, B Block, Amritsar - 143002, Near V"
"IDM solutions p ltd","+ 91  7837713660","shop no 87 2nd floor Nehru shopping complex, Lawrence Road, Amritsar - 143001, novelty chowk"
"Global migration & education s...","+ 91  183 2508020","Sco-6 2nd floor, B block market distt,shopping complex, Ranjit Avenue, Amritsar - 143001, Ranjit avenue"
"Visa Solution","+ 91  9878867369","1st Floor Sharma Complex, Hukam Singh Road, Amritsar - 143001, Near Hussianpura Chowk"
"Advance Solutions","+ 91  183 5063834","110a, Lawrence road, Amritsar - 143001, Opp. Ritu wears"
"Svs Global Immigration & Edu S...","+ 91  183 5007728","Amritsar - 143001"
"EXPERT IMMIGRATION","+ 91  9216201616",""
"IDM SOLUTIONS PVT LTD","+ 91  183 5098381","Shop no 81 2nd floor, Lawrence road, Lawrence Road, Amritsar - 143001, Nehru shopping complex"
"Tejpal immigration","+ 91  183 5007517","Sco-6 2nd floor, Distt shopping cimplex, Ranjit Avenue, Amritsar - 143001, Uppar la pizeria"
"Unicon Investment Solution","+ 91  183 5070474",""
"matrix solution","+ 91  8427840827","majhita, Lawrence Road, Amritsar - 143001, majhita road"
"Kats immigration","+ 91  9988603928","Sco 6,forth floor,b-block, District shopping complex,ranjit avenue, Amritsar - 143001, Near punjab kesri office"
"Insite Solutions","+ 91  183 5007986",""
"Advance Solutions","+ 91  9418041050","Lawrence Road, Amritsar - 143001"
"Rebsec solution","+ 91  9217027006","57, B block market,ranjit avenue, Amritsar - 143001, Opp.parvati devi hospital"
"Lasertech Printer Solutions","+ 91  183 5010840",""
"Clg Print Solutions","+ 91  183 6980263","Opp. Safri Arts, Katra Sher Singh, Amritsar - 143006, Near Subash Juice Bar"
"Eves Immigration Consultants","+ 91  8054616204","62/A Doctor Complex, Majitha Road, Amritsar - 143001, Opp. Madan Hospital"
"White Rock Solution","+ 91  9855235235",""
"Kreative Computers and it solu...","+ 91  9915708673","Inside dilawri market, Lawrence Road, Amritsar - 143001, Opposite Kochar Call Centre"
"Heat Solutions","+ 91  183 2220147",""
"A-one Tile Studio","+ 91  7307051567","Shop No: 199, Chitra Talkies Road, Amritsar - 143001"
"Atoz Solutions","+ 91  183 5060528",""
"SSSS Immigration Services","+ 91  183 5832451","Building Number-33-A,Shop Number-2, Rani Ka Bagh, Amritsar - 143001, Near Archies Gallery"
"Air Fare Solution","+ 91  183 2560122",""
"A-One Kulfa & Pizza","+ 91  183 2553352","Guru Kripa Selection House, Goal Hatti Chowk,Hall Bazar, Amritsar - 143001"
"Smc Investment Solution","+ 91  183 2534566",""
"Pentagems Solution","+ 91  7837608389","near dav college library gate, Amritsar Bus Stand, Amritsar - 143001, Near Shastri Market"
"A ONE COMMUNICATION","+ 91  9780594907","Shop no 107, Katra sher singh, Katra Sher Singh, Amritsar - 143006, Hall bazar"
"Mohini solutions pvt.ltd","+ 91  183 5025500",""
"A one travels","+ 91  183 2548377",""
"Web Solutions India","+ 91  183 2550334","278, Pritam Dass Gali, Amritsar - 143001, Inside Sultanwind Gate"
"Integrated Computer Solutions","+ 91  9815300987","Batala Road, Amritsar - 143001, Nr Prem RAI Hospital"
"AQUA PRO SOLUTIONS","+ 91  9888905481","192, Lane-4, Vijay Nagar, AMRITSAR - 143001, Batala Road"
"Bala Immigration Guidance Serv...","+ 91  9872212270","2929/2, Pakki Gali, Amritsar - 143001, Outside Mission Compound"
"Stop & Stop","+ 91  183 5005188","Grocery Store 79,, Amritsar Bus Stand, Amritsar - 143001, Mohani Park"
"Sethi Insurance And Investmen...","+ 91  9872222551","497-C, Basant Avenue, Amritsar - 143001, Near PNB, Near Lawrence Road"
"Stop N Shop","+ 91  183 5016161","Sco 35 C Block, Ranjit Avenue, Amritsar - 143001, Near El Dorado Restaurant"
"Infotel Business Solution","+ 91  183 5022429","Dsc Ranjit Avenue, Amritsar - 143001"
"Nova Overseas Solution","+ 91  8195851666","S. C . F 53 top floor, Kabir park market, Amritsar - 143001, Opp. G. N. D. U"
"Victoria Immigration & Education","+ 91  183 5098112","Scf-35, Amritsar - 143001, Kabir Park,Opposite Guru Nanak DEV University"
"Health Way Immigration","+ 91  9888888125","Court Road, Amritsar - 143001"
"Cic Immigration","+ 91  8872634791","Court Road, Amritsar - 143001"
"DOLPHIN BUSINESS SOLUTIONS","+ 91  183 5098907","Shop no 7, Queens road, Amritsar - 143001, Near sangam motors"
"Virtual Solutions","+ 91  9888494952","2nd Flr,Queens Cplx, Queens Rd, Amritsar - 143001, Nr Railway Station"
"SONA for the gorgeous one","+ 91  183 5098024","shop no.19, 1st floor, Amritsar - 143001, Alfa one mall"
"Goodwill Immigration","+ 91  9814778926","Amritsar - 143001, Ranjit Avenue"
"Mobile Solution","+ 91  9888366438","Vijay Nagar,Amritsar, Amritsar - 143001"
"Right Way Immigration","+ 91  9569137200","Amritsar - 143001, Ranjit Avenue"
"All Blacks Immigration & Educa...","+ 91  8146541236","Ptk Bye Pass, Amritsar - 143001"
"Express Immigration","+ 91  9815258826","Opposite Ram Mandir, Amritsar - 143001"
"Advertiser A Complete Printing...","+ 91  9646043151","Amritsar - 143001, Adresh Nagar, Islamabad"
"G Next Marketing Solutions","+ 91  183 5003509","Number 6, Loharka Road, Amritsar - 143001, Opposite Punjab National Bank"
"Habile Outsource Business S...","+ 91  9780786544","755/7, Gali Teliya Wali, Amritsar - 143006, Near Namak Mandi"
"Golden Security Solutions","+ 91  9815645316","Sco 121 Third Floor Deep Complex, Court Road, Amritsar - 143001, Opposite Doaba Automobile"
"Pest Control Solutions","+ 91  183 5063643","7 Aga Market Ground Floor, Taylor Road, Amritsar - 143001"
"Noc Immigration Pvt Ltd","+ 91  183 5056563","Sco 36 & 53 B Block Ranjit Avenue, Amritsar - 143001, Near Balle Bowl Restaurant"
"Bedi it solutions","+ 91  9988961931","Shop Number 592 Main Bazar Sharifpura, Gali Number 5 Kuthia Wali Gali, Amritsar - 143001, Near Bus Stand"
"Global Immigration Consulta...","+ 91  183 5015277","Sco 6 Second Floor District Shopping Complex, Ranjeet Avenue Block B, Amritsar - 143001, Near Connect Office"
"A One Snacks Corner","+ 91  9988940037","Dsc Booth Number 65 B B block Market, Ranjit Avenue, Amritsar - 143001, Opposite M K Hotel"
"Die Hard Solution","+ 91  9888698871","Gurulal Bazar New Partap Nagar, Gali Number 4, Amritsar - 143001"
"Saffron Sun Security Soluti...","+ 91  9417665991","Tarn Taran, Jandiala Road, Amritsar - 143001, Opposite Malhiwala Petrol Pump"
"A One Snacks Corner","+ 91  9988940037","Booth No 65, Ranjit Avenue, Amritsar - 143001, Opp M.K Hotel"
"Make It For Me Creative Sol...","+ 91  9780839862","2814, Moni Chowk, Amritsar - 143006, Inside Chatiwind Gate"
"Security Solution","+ 91  9915827500","Building Canara Bank, Jandiala Road, Amritsar - 143002, Near Hdfc Bank Tarn Taran)"
"Punjab Printing And Packing...","+ 91  9988880614","Amritsar - 143002"
"S S S S Immigration Services","+ 91  183 5018295","Number 280 Partap Avenue Phase 2 G T Road, Amritsar - 143001, Opposite Alpha One Mall"
"Srj Water Solutions","+ 91  9478615415","Main road, Khandwala, Khandwala, Amritsar - 143105"
"K D Water Solutions","+ 91  9464020768","Bedi Market, Majitha Road, Majitha, Amritsar - 143601, Near Mai Bhago Girls Collage"
"Sustech Power Solutions Pvt...","+ 91  7087864444","Baba Darsan Singh Dera Ram Tirth Road, Meera Kot, Amritsar - 143103, Near By Pass"
"Alpha One Mall","+ 91  183 6618545","Main GT Road, Amritsar - 143001, MBM Farms, Sultan Wind Sub Urban"
"Shoppers Stop","+ 91  183 6611900","Alpha One Mall, G T Road, Amritsar - 143001, Near Ista Hotel, Mbm Farms"
"One Stop Immigration Solutions","+ 91  183 5066680","Sco 44,Kabir Park Market, GT Road, Kabir Park Colony, Amritsar - 143002, Opposite GNDU"
"One Point Majestic Solutions P...","+ 91  183 2223455","29, Queens Rd, Amritsar - 143001, Opp Popular Bakery"
"One Point Loggistics Solution ...","+ 91  183 4621916","105, Prestige Chamber, Nr. Narinder Cinema, Amritsar - 143001"
"One Stop Computer Shop","+ 91  9815236000","Amritsar - 143002"
"One stop pet shop","+ 91  9988423224","Sh no 80, Opp. G . N . D . U , kabir park market, Amritsar - 143001"
"One Stop Pet Shop","+ 91  9646147208","Shop no 80, Kabir park market, Amritsar - 143002, Opp GNDU"
"One World Travels","+ 91  183 6533768","Shop No-16, Grd Flr, Pt Din Dayal Upadhya Cplx, Amritsar - 143001, Bhandari Bridge"
"One World Consulting Group","+ 91  183 5014040","Amritsar - 143001, Ranjit Avenue"
"One Way Car","+ 91  9464493347","Shop Number 9 Gol Bagh, Amritsar - 143001, Backside Railway Station"
"The One","+ 91  183 5061111","C/O BEST Western Merrion,45, District Shopping Complex, Ranjeet Avenue Block A, Amritsar - 143001"
"One Step","+ 91  9646000890","Shop No. 17, Hundal Market Gali No. 8, Amritsar - 143001, Kot Baba Deep Singh, Near Gurudwara Sheedha Shahib"
"one o one","+ 91  8427026318","5, majitha road, Amritsar - 143001, oppsite ent hospital"
"One o one","+ 91  9646708013","Majitha road, Amritsar - 143001, Ghala mala chowk"
"One Direction Studio","+ 91  9876237338","uper Krishna Vatrayala Building, Basant Avenue, Amritsar - 143001, Near Ajanta Public School"
"One ness travels","+ 91  183 5010382","43/7, Amritsar Bus Stand, Amritsar - 143001, Opp guru Nanak auditorium"
"109 F Store","+ 91  183 5034465","Shop Number- G-25, Ground Floor, Alpha One mall, Main G T Road, Amritsar - 143001, Near Mbm Farms"
"Cwc Immigration Solutions","+ 91  183 2504466","Sco-112, 2nd Floor, Amritsar - 143001, Near Old Passport Office, Near ICICI Bank"
"i can... IMMIGRATION Solutions","+ 91  1859 222222","Opp. Oriental Bank of Commerce, College road, Khadur Sahib, Amritsar - 143117"
"Sky High Immigration","+ 91  183 2422283","Shop Number 90 Deep Complex, Court Road, Amritsar - 143002, Near Doaba Auto"
"Smart Cooling Solutions","+ 91  183 2211909","Shop Number 8 Lawrence Road Extention Meenu Market, Dasunda Singh Road, Amritsar - 143001, Opposite Pick and Move Barbeque Near Archies Gallery"
"Harbingers Computers Computer ...","+ 91  183 5068899","Shop No-2, Kashmir Plaza, Batala Road, Amritsar - 143002, Opp Petrol Pump"
"SCHOLARS WAY IMMIGRATIONS","+ 91  9779345533","Sco 69 kabir park market, Amritsar - 143001, opp GNDU"
"Scholars Way Immigration Consu...","+ 91  183 225433","Sco 69, Guru Nanak DEV University, Amritsar - 143005, Kabir Park Market"
"A one Car Washing","+ 91  8427740677","Shop no-22B, Kabir Park Colony, Amritsar - 143002, Behnd Amber Hospital,opp Universityl"
"Enrich Education & Training So...","+ 91  7696005014","sco 61, kabir park market, Kabir Park Colony, Amritsar - 143002, opp GNDU university"
"Canreach Immigration Consultin...","+ 91  183 5015233","Batala Road, Amritsar - 143001"
"A M Solutions","+ 91  183 2273999","Batala Road, Amritsar - 143001"
"ENRICH EDUCATION & TRAINNING S...","+ 91  183 5061313","SCF 61 Kabir park market, Amritsar - 143001, opp GNDU UNIVERSTY"
"Punjab Computers And Networkin...","+ 91  183 5005477","Kabir Park Colony, Amritsar - 143002"
"G-Next Marketing Solutions","","#1, Sanjhi Market, Main Road, AMRITSAR - 143001, Peepli Sahib Gurdwara"
"Elite Immigration Consultant","+ 91  183 2255222","SCF -43, 1st FLOOR,, KABIR PARK MARKET, Amritsar - 143001, OPP. G.N.D.U"
"NAVADA TOUR AND TRAVEL &IMMIGR...","+ 91  183 5013873","Sco 34, Kabir park, Amritsar - 143002, Opp gndu"
"Fuel Stop","+ 91  183 5013333","Alpha Mall, G T Road, Amritsar - 143001, Near g.t .road"
"A one dye cleaner","+ 91  7837361710","shop no.8, Amritsar - 143006, near Hindu Sabha post office"
"Om Sai Laptop Solution","+ 91  9878221415","Ravi Dass Road, Gandhi Bazar, Amritsar - 143006, Near Baldev Pehlwan, Arora Market"
"A One General Store","+ 91  8437555358","Shop no. 2, Gt Road, Amritsar - 143001, Opposite dashmesh academy"
"Amrik Singh & Sons A One Jewel...","+ 91  183 2257097","opp. sharma furniture, Chheharta, Amritsar - 143105, Pratap Bazar"
"Hi-Tech Computer Solution Inst...","+ 91  183 2476955","Bhakna Kalan, Chheharta, Amritsar - 143105"
"All In One Travels","+ 91  8437431313","shop n0 8, new medicle enclave, circular road, Amritsar - 143105, near trilium mall"
"K.V.S. Computer Solution","+ 91  8284030009","Gali No.3, 7km from railway station, New Ranjit Pura, chheharta, Chheharta, Amritsar - 143105, Opp. Police Station"
"Perfect Security Solution","+ 91  7087208293","House Number - 12, Kale Ghano Pur Road, Gali Number - 2, Chheharta, Amritsar - 143105, Near Sharaswati Road, Master Avenue"
"Green Future Unit Pest Control...","+ 91  7837525301","Verka, Amritsar - 143501"
"A One Tailor","+ 91  9462572818","wagha border-wrong no, attari bazzar, Attari, Amritsar - 143108, Bus Stand"
"Forever DJ Complete Solutions","+ 91  9876889324","G T Rd, Tangra, Amritsar - 143149, Near Excellent Gym"
"power acoustic solution","+ 91  9312701278","Mehta Chowk, Amritsar - 143114, opp patrol pump"
"A-One Readymade Garments","+ 91  1853 221123","G T Road, Rayya, Amritsar - 143112"
"Dee Vee Property Management So...","+ 91  1853 605000","Sidhu Enclave, Beas, Rayya, Amritsar - 143112, Near Grain Market, Rayya"
"Wonder Web Solutions","+ 91  9878552060","House Number-59, Dbm Road, Batala - 143505, Near Pnb Bank"
"A One Battery","+ 91  9888443066","Batala, AMRITSAR - 143505"
"A One Mobile Shop","+ 91  9855272727","Shop Number-41, Street Number-. 25, Jalandhar Cantt, Jalandhar - 144005, Sadar Bazar"
"Kingsway Immigration & Oversea...","+ 91  172 5003357","Sco-80-81-82 First Floor, Chandigarh - 160020, Sec 34 A"
"9th Gen Web Solutions","+ 91  172 4003200","196, Chandigarh - 160002, Industrial Area Phase II"
"Solution Engineers","+ 91  1762 644279","Derabassi, Zirakpur - 140507, Hanuman Colony, Near Dappar Toll Tax"
"Concept Lighting Solutions Ltd","+ 91  11 40503120","D-10/6, Delhi - 110020, Okhla Indl Area Phase-1"
"Safety Solutions Inc","+ 91  80 26787143","No 15,20th Mn,B L M Layout, 100 Feet Ring Rd, BANGALORE - 562123, 2nd Stage"
"Clg Print Solutions","+ 91  183 3213994","H.o- 9, Pink Plaza Mkt., O/S. Hall Gate,"
"Basic Computer Solution","+ 91  183 3123019","9, Surya Arcade, Hall Bazar,,"
"BEE Power Solution","+ 91  183 5050032","Sco 6, 1st Fl., Ranjit Avenue,,"
"A One Car Stereo & Shingar Centre","+ 91  183 2711979","Fatehgarh Churian Rd.,"
"B2 Solutions (India)","+ 91  183 5101449","57-58, Deep Com.,,"
"Clg Print Solution","+ 91  183 2549172","9, Pink Plaza,,"
"A One motor garage","+ 91  7837528382","Shop no 66, green plaza market, Amritsar - 143002"
"ANIL SOLUTIONS","+ 91  9815081111","shop no. 15, tehsilpura, Amritsar - 143002, Opp. Dr. Surinder pal singh"
"Amit Mobile Solution","+ 91  9569422803","Shop no G-7, bawa market, Amritsar - 143002, b/s prakash plaza"
"peer web solutions","+ 91  9814743734","Shop No-1, Hargobind Avenue, Majitha Road, Amritsar - 143001"
"Peer Web Solutions","+ 91  9779223962","Sco-2 , Hargobind Avenue, Majitha Rd, Amritsar - 143001, Nr Reliance Fresh"
"VISQM Immigration","+ 91  9888855220","Airport Rd,Gumtala By Pass, Amritsar - 143001"
"Singh Immigration","+ 91  183 2226222","Opp. Khalsa College, Near Reebok Showroom, G.t.road, AMRITSAR - 143001"
"SOUL SOLUTIONS","+ 91  183 2210188","108, Park avenue, Amritsar - 143002, Near aggarwal marble house"
"Sharp IT Solutions","+ 91  183 2502378","Fb-4 Gndu Shopping Complex, Amritsar - 143002"
"A One Snacks Corner","+ 91  8054224339","Ranjit avenue, Amritsar - 143002, Near LIC Office"
"Angels Immigration & Education...","","SCO 68, Amritsar - 143002, City Centre Market"
"A One Shine Beauty Parlour","+ 91  9478444291","Majitha Road, Amritsar - 143002, Prem Nagar"
"VARDHAMAN CEILING SOLUTIONS","+ 91  9215834176","Asr- jal higway, Amritsar - 143002, Amritsar"
"Golden Square Ultimate Realy S...","+ 91  9814898684","Amritsar - 143002, Near Millennium Gate G T Road"
"Elite Immigration Consultants ...","+ 91  9023284463","Amritsar - 143002"
"TOTAL SOLUTION","+ 91  9888829010","2375/12, islamabad, Amritsar - 143002, near jwala flour mill"
"Motorola Solutions India Pvt. Ltd","+ 91  9811688877","415/2, Sector 14, M G Road,Gurgaon, Amritsar - 143002"
