"Name","Phone","Address"

"Sood & Sood Associates","+ 91  1882 222624","Sood & Sood Building, Court Road, Hoshiarpur - 146001"
"Disha Job Placement","+ 91  1882 504047","Sco-7,2nd Floor, In City Centre, Hoshiarpur - 146001, Near Bus Stand"
"Finance Way","+ 91  9501536783","8, wakila bazar, redcross market, Hoshiarpur - 146001, opp bsnl telephone exchnge"
"Vatts Professional","+ 91  8568025750","2nd Floor, Lakshmi Building, Hoshiarpur - 146001, Shimla Pahari Chowk, Opposite New Deluxe Bakery"
"North American Training Instit...","+ 91  1882 503832","Sutheri Road Near, Govt College Chowk, Hoshiarpur - 146001, Opp Lakh Data Peer"
"Ravindra Job Track","+ 91  1882 250708","Govt College Rd Pale Da Bagh Wali Gali, Hoshiarpur - 146001, Nr Gurcharan Kanwal Hospital"
"Him Employment Pvt Ltd","+ 91  9878444737","Vpo Agahar,Teh Fatehpur, Dist. Kangra, Chandigarh, Chandigarh, Industrial Area, Straight Highway 27, Talwara Township, Talwara Township, Hoshiarpur - 144216"
"Business Infotech","+ 91  9589044555",""
"Tds Placements & Services P...","+ 91  172 5214647","SCO No.- 910, NAC Manimajra, Mani Majra, Chandigarh - 160101"
"Sky World Services","+ 91  9814296732","Sco 42 Second Floor Phase 7, Mohali, Chandigarh - 160062, Near Scooter Motor Market And Above Vanheusen Showroom"
"D.V Consultancy","+ 91  712 6960267","618, Pushpa Apartment, Kamptee Road, Dr Ambedkar Marg, Nagpur - 440017, Near Indora Square"
"Crest technology","+ 91  8237185135","Shirkh plaza above vidharbha furniture, manish nagar road, Manish Nagar, Nagpur - 440015, infront of kachore lawn"
"gCO of Agriculture departme...","+ 91  7379021104","payagipur, Sultanpur - 228001, near payagipur chowk"
"Lakkho HR Consultants Pvt Ltd","+ 91  9755040645","Office No 1, Shri Mayaramji Palace, Kolar Road, Bhopal - 462042, Lalita Nagar Bus Stop"
"Infinite Manpower Solution","+ 91  8269838429","E 28/B, Jhansi Road, Lashkar, Gwalior - 474001, Near Hari Shankar Puram"
"GRR Consultancy","+ 91  4142 254875","No 1, Spt Main Nagar Vadakuthu, Gandhi Nagar, Neyveli - 607308, Opposite Nlc Arch Gate"
"Aggarwal Job Consultants","+ 91  9541382141","Scf 179 First Floor Huda Complex, Rohtak - 124001, Behind Axis Bank Opposite Bsnl Office"
"Dreambolic Associates","+ 91  181 4659111","303 Second Floor Prestige Chamber, Jalandhar City, Jalandhar - 144001, Opposite Narinder Cinema"
"Hiringshop.Com","+ 91  9829069780","517, 3rd Floor, Anchor Mall, Ajmer Road, Jaipur - 302024"
"Asia Pacific","+ 91  484 4064431","Jose Brother Building, M G Road, Jos Junction, Ernakulam - 682016, Near Jose Junction"
"ORISSA DOOT CONSULTANTS","+ 91  674 6557773","Plot No-733, Sahid Nagar, Bhubaneshwar - 751007"
"Varun Star Services Pvt Ltd","+ 91  8146951375","Sco 2 Phase 2, Kharar, Mohali - 140301, Near Franco Hotel"
"Sks Consultancy","+ 91  471 3199100","Shop No 5 Prs Court, Ambujavilasom Road, Pulimoodu, Thiruvananthapuram - 695001"
