"Name","Phone","Address"
"Surya Marketing","+ 91  9446002449","K P 's stores 11 th mile, pullumkunnu road, Ramanattukara, Kozhikode - 673633"
"SRS Marketing","+ 91  9061414156","Iind Floor, Kandamkulam Road, Calicut Rec, Kozhikode - 673601, Diera Bazar"
"Falcon Sales & Marketing Services","+ 91  483 2891975","Pullipparambu, Chelembra, Malappuram - 673634"
"Capital Marketing","+ 91  495 4060960","Space Mall, Jafferkhan Colony Road Mavoor Road, Calicut Rec, KOZHIKODE - 673601, Opposite To Bhima Jewellery"
"Zest Marketing International","+ 91  495 2723427","Apco Towers, Ail Road, Calicut - 673601"
"Samay Marketing","+ 91  495 2769003","7/14a, 11, Mananchira Towers, A G Rd, Calicut - 673601"
"Well Wish Marketing","+ 91  495 2301965","Post Office Bldg,, Parappil,, Calicut - 673601, Fraancis Rd"
"Olive Marketing","+ 91  495 2741577","H 29/816f1 Parancheri Mavoor Road, Calicut - 673601"
"Novy Marketing","+ 91  495 2720590","10/419, Baby Bzr, Calicut - 673601"
"Solar Marketing & Services","+ 91  495 2445221","Kokkalai, Calicut - 673601, Casino Hotel"
"Power Marketing","+ 91  495 2725614","17/1261 A, Vbp Complex Ram Mohan Road, Calicut - 673601"
"Delux Marketing","+ 91  495 2766706","3/945n, Thanveer Complex West Nadakkavu, Calicut - 673601"
"Gems Marketing Agencies","+ 91  495 2765356","Calicut - 673601"
"Hose India Marketing","+ 91  495 2702363","13/457 J, Ekarnaparamba Palayam Road, Calicut - 673601"
"Relax Marketing","+ 91  495 2368375","5/36 A, Nr Post Office, Eranhipalam, Calicut - 673601"
"Classic Marketing","+ 91  9947341934","Jidda Building, S M Street, Calicut - 673601, Near Witco"
"Excel Marketing","+ 91  9746272734","Anand Bazar, M P Road, Calicut - 673601, Near Moiden Palli"
"K V Marketing","+ 91  495 2211493","K V Marketing, Koduvalli, Kozhikode - 673572"
"S L Marketing","+ 91  9645650386","Koduvalli, Kozhikode - 673572, Kareettipparam Manipuram"
"S K S Marketing","+ 91  9388449967","Thamarassery, Vavadu, Kozhikode - 673572"
"Vinsat Marketing","+ 91  495 3157742","Vinsat Marketing, Omassery, Omassery, Kozhikode - 673572"
"Midas Marketing","+ 91  9946482000","Palakkutty Building, Wayanad Road, Koduvalli, Kozhikode - 673572, Near Mele Palakkutty Masjid"
"Star Marketing","+ 91  8943537969","Omassery, Calicut,, Omassery, Kozhikode - 673572"
"Metro Marketing & Distributions","+ 91  9048011135","Metro Marketing & Distributions, 1st Floor, Marakkar Haji Building, Opp. Carmel Convent, Calicut, Mukkam, Kozhikode - 673602"
"Zella Marketing","+ 91  9895080822","Thamarassery, Kozhikode - 673573, Near H P Petrol Pump"
"Fortune Marketing","+ 91  496 2645480","Poonur, Unnikulam, Kozhikode - 673574"
"Malanad Marketing Society","+ 91  9747004037","Thiruvambaby, Calicut, Thiruvambadi, Kozhikode - 673603"
"The Calicut District C-Operati...","+ 91  496 2660502","1879 F, Koorachunduathiyadi, Calicut - 673527"
"Rubber Dipo Marketing Society","+ 91  495 2253502","Rubber Dipo Marketing Society, Koodaranji, Kozhikode - 673604"
"Kailas Marketing","+ 91  496 2614885","Machine House,Kailas Cmplx, Perambra, Kozhikode - 673525, opp bus stand"
"Royal Marketing","+ 91  496 3223225","Perambra, Kozhikode - 673525"
"C & F Alapatt Marketing Co","+ 91  495 6502195","Kundayithode, Kolathara, Kozhikode - 673655"
"NAL MARKETING","+ 91  9656775088","Machanoor Complex, Near Cheruvannoor, Cheruvannoor, Kozhikode - 673524, High School"
"Royal Marketing","+ 91  9809565656","Machanoor Complex, Cheruvannoor, Kozhikode - 673524"
"Vava Marketing Associates","+ 91  9496915637","Villyappally, Calicut, Villyappalli, Kozhikode - 673542, near police aid po"
"ATC Marketing","+ 91  9048597638","AAA Complex, Wayanad Road, Kuttyady, Kozhikode - 673508, Near Petrol Pump"
"Malabar Marketing","+ 91  496 3254769","Malabar Marketing, Big Bazar, Kozhikode - 673103"
"Pootholy Marketing Company","+ 91  496 2522930","Main Road, Vadakara Beach, Kozhikode - 673103"
"Swarnasri Marketing","+ 91  4936 203290","Kalpetta, Wayanad - 673121"
"kdc rubber marketing","+ 91  496 2661208","Kdc Rubber Marketing, Athiyodi Koorachundu, Athiyodi, Kozhikode - 673527"
"porchune stationery marketing","+ 91  9846030410","Porchune Stationery Marketing, Poonur Unnikulam, Poonoor, Kozhikode - 673574"
"Renal Marketing","+ 91  9747110041","Renal Marketing, Poonoor, Kozhikode - 673574"
"Bik-Maark International Market...","+ 91  484 2611122","Bldg. No. 10-Sf2, 2nd Floor Teepeeyem Square, Near VIP Road International Airport, Nedumbassery, Calicut - 683572"
"Orient Marketing,","+ 91  484 3201493","36/107, 4 A, Daya Building, Judges Avenue,, Calicut - 682017, Kaloor"
"Kajah Marketing Company","+ 91  479 2551585","1 / 320, Muthuvattoor,, Calicut - 690513"
"Royal Marketing","+ 91  495 2355237","Jijeesh Bldg, Patteri Jn, Kuthiravattom, Kozhikode - 673016, Nr Kseb"
"Yem Marketing","+ 91  9341230341","No.3, 5th Crs,Krishnappa Lyt,80ft Rd,Mangammanpalya, BANGALORE - 560068, Adj To Hsr Lyt"
"Cal On Marketing Pvt Ltd","+ 91  40 27201894","No.16-51, Prashanth Nagar, Uppal, Hyderabad - 500039, Opp Survey Of India"
"Ashinishi Marketing & Engineer...","02652580936","No.8 Jaydeep Complex,Dabhoi Road, Pratapnagar, Vadodara - 390001, Near Zenith School Char Rasta"
"Shree Ganesh Marketing","07312482345","1885 D,Sudama Nagar, Indore - 452008"
"I Adept Marketing","01128033882","310 Mass Cghs,Plot No.24, Sec-10,Dwarka, Delhi - 110075"
"Metalon Marketing","01142786392","158/7-A,1st Flr,Manohar Mansion, Ajmeri Gate, New Delhi, Delhi - 110006"
"Vyshnav Technologies And Marke...","",""
"Shine Marketing","+ 91  495 3208304","Shine Marketing, Kallai Kozhikode, Kozhikode"
