"Name","Phone","Address"

"Hind Automobiles","+ 91  1882 223080","Jalandhar Road, Hoshiarpur - 146001, Near P.N.B Bank"
"Ashoka Tractors","+ 91  1882 223118","Phagwara Road, Hoshiarpur - 146001, near bank of maharastra"
"Arora Tyre Traders","+ 91  1882 223129","Phagwara Road, Hoshiarpur - 146001, Near Union Bank Of India"
"Tyre Boutique","+ 91  181 4628446","185, Civil Lines, Jalandhar City, Jalandhar - 144001, Shastri Market"
"Vijayshree Agencies","+ 91  8394 225487","Ranipet, Hospet - 583201"
"Monga Tyre Pvt Limited","+ 91  9814023642","G T Road, Ludhiana - 141003, Opposite Hero Cycle"
